record_id,created,created_by,description,id,last_modified,last_modified_by,recommendations,recommendations_v2,title
recG9fcKb8n1bTqBw,2025-06-09T16:55:53.000Z,"{""id"": ""usrdgG7vRV8iqukqL"", ""email"": ""keegankdolan@gmail.com"", ""name"": ""Keegan Dolan""}","Explicit physical activities or movement patterns that improve healthspan (e.g., Zone 2 cardio, strength training, daily steps).",RT001,2025-09-07T20:53:17.000Z,"{""id"": ""usrdgG7vRV8iqukqL"", ""email"": ""keegankdolan@gmail.com"", ""name"": ""Keegan Dolan""}","recyCjSxWdLGZfHwI, recqj8q9IIWoThFkG, recx4JdeaTZgIVoZ3","recC3HYOpjcuSTlGZ, recuKwwqbOncMVjuX, recBv7jvDZq4Bz29k",Activity
recqHQHN1HyB2bYIb,2025-06-04T22:56:20.000Z,"{""id"": ""usrdgG7vRV8iqukqL"", ""email"": ""keegankdolan@gmail.com"", ""name"": ""Keegan Dolan""}","Specific dietary modifications or protocols that impact metabolic, cardiovascular, or inflammatory health.",RT002,2025-09-07T20:53:17.000Z,"{""id"": ""usrdgG7vRV8iqukqL"", ""email"": ""keegankdolan@gmail.com"", ""name"": ""Keegan Dolan""}","recj4S8iGZ5mXx4NS, recu8nVY5FrP2YCVR, rec949y9L8RuJ25yP, recIRf5TBEMboKqVm, recHzb6cKfnSgyEzu, rec51TDeLYX6vOI1v, recMV3jzfb4sKW5vY, receDJo2S8FqzNOrm, recnSEMu0buoaCSvm, rec3vdJyRz5x9yYJ6, recMWhvrT57rQOSyU, recTnxfnpWuWO6CRg, recGXWM4L7vUbxfCd, recMEPqal9VglyK6U, rechz1JGiQJCv9YJo, recCqwYvk7o9NLZye, rec4hs6FOKci6FcHD, receMjPXD2cZs6rer, recPnCzFAy0LTJ9C1, recf94WHfCkB3aoTA, recq2dRUP4FLao9gd, rectiHMpuqUW6EpOg, recDVZeEtpOMlhHaY, recIoVf6FOKFcUX8p, recn4eGEOf9XA0tat, recApH4t4nFb8maup, reckLfq4q5YH3ChjU, recvLB6CCcDJhm1Fx, recgFS8idJ1Rz8Msu, recPgYrf87WKNpens, recs1Yx1aoyTCalz2, recxd0ZkIKfdSxVMp, recr7AtTCj4d026By, recB2JtyJ9bvr8qWT, recdUipe4wxEhf4uC, recUROIBVBAObV7l2, reciGprkevaemYHuP, recIO41LpxD5gj47B, recxoe009Z2wEIjIq, recXEzuSgRogrTVp5, recCGSspjFrrF9fg3, reczMIC9rZdAuBwLG, recUk7Y0cYFgRAOg5, recWJPLkPnQbaX9eI, recGQyztbSj4MyEaU, recMfTk8ITmrFJowR, recz8gAMEHUAYrsVo, recvv2HVgKwsoHdQD","rec9shJve4oUosmbM, recnvgez95waQbIX9, recyzL1fyLSDVCg58, recQGhqpbZNfyn2G8, recDzEG37NloR565F, reczWqNcJQXghlR0U, recL0zctdlOG9ciJL, recdvxEqeeiiCGJI6, recMiDba4KdZho45D, recQmrpQIhvgDAJFf, reci47ujle6esrsBD, recrj2SLthVc3gwFD, rec7WBPPkFwl2cCTn, recQnFBImbyfJswIb, recXOVlES2VKHKg1x, recKokSledWI4bTMu, recQ5dwrOfm4ecogb, recl0pPXLWaqoNCTF, recGRU4MNdPXGpDIv, rec8IQcWhQD6ZjQRU, recidHVe68DNlK5oI, recTO0FW3ErzMnNMi, recjAs2YIILpWO23R, recutBXbia6z32Nqu, recxJ5SGXwlKZi3Yx, recHmnkVWvfAeVlkf, recMPjln8Ubt5yBiG, recrvCMVhlALtE7kK, recEQ5aKxt6Z10OEG, recocDwlTbpvWgVtb, reczcZcT5i4xa0FPO, reck6gezGPsFsMqCL, recTHmxwBdnyG3SxJ, recwsmDiDuZHvOZJj, recBEo5BbQG1LbzWG, recvyYza5pv1TGKLP, recFt7zPcfCjkM46a, rechlGvvxCYsaTIET, recYicOSoH1C4zLvj, recm7NxBHBB2fClE6, recMfs72SD4T9XIhS, recBPC6hC5tkxmXSH, rec15XA9JXP4kxzzm, recG7gyGMLSfyNTqk, recDd6IqU5EonfaVX, recYLv4hF464Kesqm, rec0adRBithZ3BNoZ, recKhWFKEYKSFcikb",Dietary
rech7cFeYXGie9bOl,2025-06-04T22:56:20.000Z,"{""id"": ""usrdgG7vRV8iqukqL"", ""email"": ""keegankdolan@gmail.com"", ""name"": ""Keegan Dolan""}","Lifestyle routines, habits, or mindset shifts that influence health outcomes (e.g., consistent wake time, mindfulness routine, meal timing).",RT003,2025-09-23T23:50:02.000Z,"{""id"": ""usrdgG7vRV8iqukqL"", ""email"": ""keegankdolan@gmail.com"", ""name"": ""Keegan Dolan""}","recbbFVlKZwQNf0EX, recXuOWpl8orK06ul, recrAMEvn6TQqpIMf, recRsxAqRnyD0hIL5, recKkP3TAlDTtLiuo, rec2JL5kJJ1pJCPL1, recAaYIO7j0kgDYbf, recRbJX726D4FBznW, recCAuXnKTEfdVA0Q, recTJviRFoOIYipZZ, recdOj8Nr8NO1FwR6, recuXJOhYT3ZVrOfD, recXYBL9UD1QWCF3t, recXiFdoZPO8ahvNU, rec33mt1Ib40viKUU, recMC1NC2ymnw4oc0, recUXhRwOBdDmwIz0, recjqayDOdtqvgy74, reciMtPp6Py82USrr, rece1ITrYjtv2h2G9, rec3SLnheYd7g7voW, rec6gzOrneb26gUk8, recqGXj1oW94w3reg, recDZahYDWNJwuytg, recYmmhm1c1ibQ8h3, recMPyaQMbpvDB4Fg, recmj7oZJyT7b1Zct, rec8Pb6zZXqqJdl8w, recZwg1aLhDGK0Ugs, recIjaRnoGtCO8uXx, rec3OiCYCwdkEUVOC, recHS5DnujbLJGA0X, recUcK9hjmH56wFZf, rec8lDzP6nNsCQFUK, recIHhi5vLgm1yazl, recWoGmJUWm4wpggn, recuzoqjqJctR7ahw, rec6T5WTFPHuxI0HV, rec6akLmENMwA5UR0, recdyxjcVFX1IiJmB, recgd6FoSRpsXFwGa, rec365bl5v5RJHmG9, recu6msvuyAWfCw4s, recjNCLgwgIRL0pQO, recsPMg2btkV2VLui, reclKFX6DhQ24ftN0, recMk6fKGjMET080O, recL0tr8zHEGjTEAV, reczXBfMO20DdNbq9, rec2C4Hndkvoy1Dxn, recbqfJA6wK4HdMiE, rec0os47BTvYNpKEy, recydnhcoytUM656x, receNMlaVPPdpM8lF, rec8kQTL0hFtYshjO, recWPZo0CuM633ER7, recHIhiQzo9qxQ0aE, rec0g3pUi8ZOiLy9e, recr1bYkprxDHpqqF, recTDnbMFdEillGGN, recW9EWJrKnyhWcOg, recg3Re7epEA4woTr, recTQU7jk4viGfM5L, reciAaUoOHZJUbefJ, rec4AEbFQJsIeCNOD, rec0j9ruDrnh2P6gG, recKLti4nzfTo8acc, rece9QUzAfvHZSMxU, recnCaXsF7KhzduFk, recq2gsA68cq1kCeB, recqGyakXN5etEtZk, recuLDdQ8KbpeyEPc, reckWMg3144Ab2593","recfC31Cd5XEGTEOe, rec1Vc2GOePfDEKEC, recv1aKMQckEj3mWw, recVTVGHktZrTVmVm, recOLd9a3r4HmpWEF, rec6a9bBcPsdCgtVi, recEBmO5Apr89hClw, recVC73ovc4Syfdxd, recG1S3EdZ536zea7, recXaTo88ufwRW39g, rechfHe4UeeCUja1n, recyo7UyrZuNO5spU, rec1pZRqnJsEPgjdK, rec1J3jFsVfW3V9Xb, rec7uKzibhvOoWo4b, recQ3pTTvENbpI2mh, recYoFXNhHErfamJh, recnRyEUhjUeoUchl, recmdRVGzVZWVywBI, recis6ZIrpUjVVGQq, rec7j9tyH4EV9L9yd, recaHXUIQkCQZUyup, recu7lpiR2ASpH5ox, recHqynf62exp8cDx, rec2NKnDuis64uMrk, recQgWg7fhQjwfIPx, recqKvugcEkV4FDmK, reccgzcQs3ReCRZiN, rec3XE7ren4uDEyqJ, recMKyXERMUqHM87O, rec7fGIf5CE8xyzYT, recLjtJEXpCzCkeae, recYD8fyMs8TZaj9w, reccM1F6ztegvuj41, recM8FomYRHaUcOJC, rec0P4s0n2NSp3UqE, recy0MwATPDhKLOrN, recakt2a8V8iqmERc, recaBIRD7TdktJy1h, rechZVptoLoPBWnwS, reckEuLFlXQgQjaQr, rec7xthCyBwFCl0Qq, recyxKyMXE1K8gaeJ, recne0RxZm9FEE305, recwgamjEzLJVzpEz, recpb33n6nhQXT7Xh, recQLul19pdsMEMa5, recPrRxp2N5ucxiKc, recDoZl3h8rr6rPAq, rec63sNEGqWcrFhHE, recfRDPRzCbSARqsV, rec4PQao4ZWMG3oOP, recCELntREUIFKJgO, reciearroVg1iqMvW, reccLeZ2tn6hR6Vt5, rec0gnuh5AdUWHi1o, recL9Fo72uAequEkV, rec4HrvbLeqCbpcjv, recvsz4BSxYrA34AW, recX4Lh38j56eZkQ4, rec0A220UQOmaAQYx, reckufkoHv5oXa23I, recXhidANaW6zTqf2, recm1y0FhNqxNPSp0, reciAe0Q3lWvSwqHb, recr3y3J8db5sR8PB, recutEyRzeDeUYgoS, recu7WgBqTw2mi79B, recyc1j7BQCd7ciZt, reconamkuavo4GJjk",Behavior
rec8kv0NsfQL9zWBN,2025-06-04T22:56:20.000Z,"{""id"": ""usrdgG7vRV8iqukqL"", ""email"": ""keegankdolan@gmail.com"", ""name"": ""Keegan Dolan""}",Over-the-counter supplements with evidence-based effects on specific biomarkers or health domains.,RT004,2025-10-01T16:25:22.000Z,"{""id"": ""usrdgG7vRV8iqukqL"", ""email"": ""keegankdolan@gmail.com"", ""name"": ""Keegan Dolan""}","rec1CITs0erlgrejI, rec3Lv7L4n0P5NRXG, recOifq6N7ttSB96g, recQcGEPeYqq9gkuZ, receIFIO0xrD92Ym4, recINluftAPavksWY, rec9qkWiu9H6o4rZk, recjNakoelsgINz0v, rec1uVBjIQODjal27, recqZ5QkKpTUNLuyR, recISyk9tLHy8M5nn, recMuFqL0V3Vyboh5, recF3yrCOuu1R5WWn, reca1EA58OLPRmVpr, recf2LUJMPK0syGHZ, recvkAS7HacVMiozb, rec1PrjGHQIdyGhrF, reckmGaZaq5z09MXR, recqRCEI6AzpyzFBa, recHKgsM8akY38ItI, rec8lhVZaga97JNPG, rec7fGXGOJzrAEf2H, recLr4qbLpkZNIcs1, recfr0V7Fnw7SZ4OA, recZwCmS9nIiIiDk9, recEfZBvWw9nHwH1C, recvuhgMsucQvK38B",,Supplement
recyN1J7mIU6YYhll,2025-06-04T22:57:14.000Z,"{""id"": ""usrdgG7vRV8iqukqL"", ""email"": ""keegankdolan@gmail.com"", ""name"": ""Keegan Dolan""}",Physician-directed prescriptions or therapies that require clinical supervision.,RT005,2025-06-09T16:59:08.000Z,"{""id"": ""usrdgG7vRV8iqukqL"", ""email"": ""keegankdolan@gmail.com"", ""name"": ""Keegan Dolan""}",,,Medical
rec8QrIv46BGTlxEl,2025-06-04T22:57:15.000Z,"{""id"": ""usrdgG7vRV8iqukqL"", ""email"": ""keegankdolan@gmail.com"", ""name"": ""Keegan Dolan""}","Adjustments to external conditions that influence physiology, recovery, or circadian rhythm.",RT006,2025-06-09T16:59:08.000Z,"{""id"": ""usrdgG7vRV8iqukqL"", ""email"": ""keegankdolan@gmail.com"", ""name"": ""Keegan Dolan""}",,,Environmental
recGoh3z4Kgg5dQpd,2025-06-04T22:57:16.000Z,"{""id"": ""usrdgG7vRV8iqukqL"", ""email"": ""keegankdolan@gmail.com"", ""name"": ""Keegan Dolan""}",Suggested diagnostic tests or screenings to identify underlying risks or monitor intervention impact.,RT007,2025-10-01T16:25:22.000Z,"{""id"": ""usrdgG7vRV8iqukqL"", ""email"": ""keegankdolan@gmail.com"", ""name"": ""Keegan Dolan""}","recFNz4Jhea4AVug4, rec4rRcozI2fwN4ZO, recl0OLC6iSTCMTZu, recsozPfurWS0N5Ox, recwr2L9Mct7dE51H, rec5SVUldpZJpTLh9, rec77NmsIIW66qoHg, recuVujFSHmDeJ3BG, rec6NwTofHBGmZInJ, recXR6RzvDkkHzi2E, recqTL66V1gh2SjeK",,Diagnostic
recW9QIHh27Sw8Zki,2025-06-09T18:43:29.000Z,"{""id"": ""usrdgG7vRV8iqukqL"", ""email"": ""keegankdolan@gmail.com"", ""name"": ""Keegan Dolan""}",,,2025-06-18T14:03:53.000Z,"{""id"": ""usrdgG7vRV8iqukqL"", ""email"": ""keegankdolan@gmail.com"", ""name"": ""Keegan Dolan""}",,,
