record_id,created,created_by,definition,example,last_modified_by,last_modified_time,linked_recommendations,name,recommendation_levels_from_linked_recommendations,recommendations_v2
recnPuigKFAPBECE6,2025-06-26T15:26:57.000Z,"{""id"": ""usrdgG7vRV8iqukqL"", ""email"": ""keegankdolan@gmail.com"", ""name"": ""Keegan Dolan""}","Minimal change, almost no barrier",Start a new supplement,"{""id"": ""usrdgG7vRV8iqukqL"", ""email"": ""keegankdolan@gmail.com"", ""name"": ""Keegan Dolan""}",2025-09-07T20:53:17.000Z,"rec51TDeLYX6vOI1v, recHzb6cKfnSgyEzu, recMV3jzfb4sKW5vY, rec3vdJyRz5x9yYJ6, recGXWM4L7vUbxfCd, recCqwYvk7o9NLZye, rectiHMpuqUW6EpOg, recn4eGEOf9XA0tat, recs1Yx1aoyTCalz2",XS,"recUosH9znhcJhhCp, recUosH9znhcJhhCp, recUosH9znhcJhhCp, recUosH9znhcJhhCp, recUosH9znhcJhhCp, recUosH9znhcJhhCp, recUosH9znhcJhhCp, recUosH9znhcJhhCp, recUosH9znhcJhhCp","rec9shJve4oUosmbM, recL0zctdlOG9ciJL, recQmrpQIhvgDAJFf, rec7WBPPkFwl2cCTn, recKokSledWI4bTMu, recGRU4MNdPXGpDIv, recxJ5SGXwlKZi3Yx, recrvCMVhlALtE7kK, recwsmDiDuZHvOZJj"
recI81s1wiUEzLscQ,2025-06-26T15:26:57.000Z,"{""id"": ""usrdgG7vRV8iqukqL"", ""email"": ""keegankdolan@gmail.com"", ""name"": ""Keegan Dolan""}","Small, incremental change, low friction	",Add a glass of water to morning routine,"{""id"": ""usrdgG7vRV8iqukqL"", ""email"": ""keegankdolan@gmail.com"", ""name"": ""Keegan Dolan""}",2025-09-23T23:50:02.000Z,"recj4S8iGZ5mXx4NS, rec949y9L8RuJ25yP, recRsxAqRnyD0hIL5, recKkP3TAlDTtLiuo, receDJo2S8FqzNOrm, recMWhvrT57rQOSyU, recMEPqal9VglyK6U, rec4hs6FOKci6FcHD, recPnCzFAy0LTJ9C1, recDVZeEtpOMlhHaY, recApH4t4nFb8maup, recvLB6CCcDJhm1Fx, recxd0ZkIKfdSxVMp, recRbJX726D4FBznW, recCAuXnKTEfdVA0Q, recdOj8Nr8NO1FwR6, recXiFdoZPO8ahvNU, recUXhRwOBdDmwIz0, rece1ITrYjtv2h2G9, recB2JtyJ9bvr8qWT, reciGprkevaemYHuP, recXEzuSgRogrTVp5, recqGXj1oW94w3reg, recUk7Y0cYFgRAOg5, recMPyaQMbpvDB4Fg, recZwg1aLhDGK0Ugs, recHS5DnujbLJGA0X, recIHhi5vLgm1yazl, rec6T5WTFPHuxI0HV, recgd6FoSRpsXFwGa, rec2C4Hndkvoy1Dxn, recydnhcoytUM656x, recWPZo0CuM633ER7, recHIhiQzo9qxQ0aE, recr1bYkprxDHpqqF, recTDnbMFdEillGGN, rec4AEbFQJsIeCNOD, rece9QUzAfvHZSMxU, recqGyakXN5etEtZk",S,"recyUarhJUq9omEm2, recyUarhJUq9omEm2, recUosH9znhcJhhCp, recUosH9znhcJhhCp, recyUarhJUq9omEm2, recyUarhJUq9omEm2, recyUarhJUq9omEm2, recyUarhJUq9omEm2, recUosH9znhcJhhCp, recyUarhJUq9omEm2, recyUarhJUq9omEm2, recUosH9znhcJhhCp, recyUarhJUq9omEm2, recUosH9znhcJhhCp, recyUarhJUq9omEm2, recUosH9znhcJhhCp, recUosH9znhcJhhCp, recUosH9znhcJhhCp, recUosH9znhcJhhCp, recUosH9znhcJhhCp, recUosH9znhcJhhCp, recUosH9znhcJhhCp, recUosH9znhcJhhCp, recUosH9znhcJhhCp, recUosH9znhcJhhCp, recUosH9znhcJhhCp, recUosH9znhcJhhCp, recUosH9znhcJhhCp, recUosH9znhcJhhCp, recUosH9znhcJhhCp, recUosH9znhcJhhCp, recUosH9znhcJhhCp, recUosH9znhcJhhCp, recyUarhJUq9omEm2, recUosH9znhcJhhCp, recyUarhJUq9omEm2, recUosH9znhcJhhCp, recUosH9znhcJhhCp, recUosH9znhcJhhCp","recnvgez95waQbIX9, recdvxEqeeiiCGJI6, recVTVGHktZrTVmVm, recOLd9a3r4HmpWEF, reci47ujle6esrsBD, recQnFBImbyfJswIb, recQ5dwrOfm4ecogb, rec8IQcWhQD6ZjQRU, recTO0FW3ErzMnNMi, recHmnkVWvfAeVlkf, recEQ5aKxt6Z10OEG, reczcZcT5i4xa0FPO, recBEo5BbQG1LbzWG, recVC73ovc4Syfdxd, recG1S3EdZ536zea7, rechfHe4UeeCUja1n, rec1J3jFsVfW3V9Xb, recYoFXNhHErfamJh, recis6ZIrpUjVVGQq, recFt7zPcfCjkM46a, recm7NxBHBB2fClE6, rec15XA9JXP4kxzzm, recu7lpiR2ASpH5ox, recYLv4hF464Kesqm, recQgWg7fhQjwfIPx, rec3XE7ren4uDEyqJ, recLjtJEXpCzCkeae, recM8FomYRHaUcOJC, recakt2a8V8iqmERc, reckEuLFlXQgQjaQr, rec63sNEGqWcrFhHE, recCELntREUIFKJgO, rec0gnuh5AdUWHi1o, recL9Fo72uAequEkV, recvsz4BSxYrA34AW, recX4Lh38j56eZkQ4, reciAe0Q3lWvSwqHb, recu7WgBqTw2mi79B"
recsORWYSS9P3wSZ7,2025-06-26T15:26:57.000Z,"{""id"": ""usrdgG7vRV8iqukqL"", ""email"": ""keegankdolan@gmail.com"", ""name"": ""Keegan Dolan""}","Noticeable but manageable effort, moderate consistency needed",Add one serving of protein at lunch,"{""id"": ""usrdgG7vRV8iqukqL"", ""email"": ""keegankdolan@gmail.com"", ""name"": ""Keegan Dolan""}",2025-09-23T23:50:02.000Z,"recu8nVY5FrP2YCVR, recbbFVlKZwQNf0EX, recXuOWpl8orK06ul, rec2JL5kJJ1pJCPL1, recnSEMu0buoaCSvm, recTnxfnpWuWO6CRg, rechz1JGiQJCv9YJo, receMjPXD2cZs6rer, recf94WHfCkB3aoTA, recIoVf6FOKFcUX8p, reckLfq4q5YH3ChjU, recgFS8idJ1Rz8Msu, recr7AtTCj4d026By, recTJviRFoOIYipZZ, recXYBL9UD1QWCF3t, recuXJOhYT3ZVrOfD, rec33mt1Ib40viKUU, recMC1NC2ymnw4oc0, recjqayDOdtqvgy74, reciMtPp6Py82USrr, rec3SLnheYd7g7voW, rec6gzOrneb26gUk8, recdUipe4wxEhf4uC, recUROIBVBAObV7l2, recIO41LpxD5gj47B, recxoe009Z2wEIjIq, recCGSspjFrrF9fg3, reczMIC9rZdAuBwLG, recDZahYDWNJwuytg, recYmmhm1c1ibQ8h3, recWJPLkPnQbaX9eI, recGQyztbSj4MyEaU, recmj7oZJyT7b1Zct, rec8Pb6zZXqqJdl8w, recIjaRnoGtCO8uXx, rec3OiCYCwdkEUVOC, recUcK9hjmH56wFZf, rec8lDzP6nNsCQFUK, recWoGmJUWm4wpggn, recuzoqjqJctR7ahw, rec6akLmENMwA5UR0, recdyxjcVFX1IiJmB, rec365bl5v5RJHmG9, recu6msvuyAWfCw4s, recsPMg2btkV2VLui, reclKFX6DhQ24ftN0, recL0tr8zHEGjTEAV, recMk6fKGjMET080O, reczXBfMO20DdNbq9, recbqfJA6wK4HdMiE, rec0os47BTvYNpKEy, receNMlaVPPdpM8lF, rec8kQTL0hFtYshjO, recjNCLgwgIRL0pQO, rec0g3pUi8ZOiLy9e, recW9EWJrKnyhWcOg, recg3Re7epEA4woTr, rec0j9ruDrnh2P6gG, recnCaXsF7KhzduFk, recuLDdQ8KbpeyEPc, recMfTk8ITmrFJowR, recz8gAMEHUAYrsVo, recvv2HVgKwsoHdQD",M,"recVQp0KNTbbjhQ4H, recUosH9znhcJhhCp, recyUarhJUq9omEm2, recyUarhJUq9omEm2, recVQp0KNTbbjhQ4H, recVQp0KNTbbjhQ4H, recVQp0KNTbbjhQ4H, recVQp0KNTbbjhQ4H, recyUarhJUq9omEm2, recVQp0KNTbbjhQ4H, recVQp0KNTbbjhQ4H, recyUarhJUq9omEm2, recVQp0KNTbbjhQ4H, recVQp0KNTbbjhQ4H, recVQp0KNTbbjhQ4H, recyUarhJUq9omEm2, recyUarhJUq9omEm2, recVQp0KNTbbjhQ4H, recyUarhJUq9omEm2, recVQp0KNTbbjhQ4H, recyUarhJUq9omEm2, recVQp0KNTbbjhQ4H, recyUarhJUq9omEm2, recVQp0KNTbbjhQ4H, recyUarhJUq9omEm2, recVQp0KNTbbjhQ4H, recyUarhJUq9omEm2, recVQp0KNTbbjhQ4H, recyUarhJUq9omEm2, recVQp0KNTbbjhQ4H, recyUarhJUq9omEm2, recVQp0KNTbbjhQ4H, recyUarhJUq9omEm2, recVQp0KNTbbjhQ4H, recyUarhJUq9omEm2, recVQp0KNTbbjhQ4H, recyUarhJUq9omEm2, recVQp0KNTbbjhQ4H, recyUarhJUq9omEm2, recVQp0KNTbbjhQ4H, recyUarhJUq9omEm2, recVQp0KNTbbjhQ4H, recyUarhJUq9omEm2, recVQp0KNTbbjhQ4H, recyUarhJUq9omEm2, recVQp0KNTbbjhQ4H, recyUarhJUq9omEm2, recUosH9znhcJhhCp, recVQp0KNTbbjhQ4H, recyUarhJUq9omEm2, recVQp0KNTbbjhQ4H, recyUarhJUq9omEm2, recVQp0KNTbbjhQ4H, recUosH9znhcJhhCp, recVQp0KNTbbjhQ4H, recVQp0KNTbbjhQ4H, recUosH9znhcJhhCp, recyUarhJUq9omEm2, recyUarhJUq9omEm2, recyUarhJUq9omEm2, recVQp0KNTbbjhQ4H, recVQp0KNTbbjhQ4H, recVQp0KNTbbjhQ4H","recyzL1fyLSDVCg58, recQGhqpbZNfyn2G8, recDzEG37NloR565F, reczWqNcJQXghlR0U, recfC31Cd5XEGTEOe, rec1Vc2GOePfDEKEC, rec6a9bBcPsdCgtVi, recrj2SLthVc3gwFD, recXOVlES2VKHKg1x, recl0pPXLWaqoNCTF, recidHVe68DNlK5oI, recjAs2YIILpWO23R, recMPjln8Ubt5yBiG, recocDwlTbpvWgVtb, reck6gezGPsFsMqCL, recvyYza5pv1TGKLP, recXaTo88ufwRW39g, recyo7UyrZuNO5spU, rec1pZRqnJsEPgjdK, rec7uKzibhvOoWo4b, recQ3pTTvENbpI2mh, recnRyEUhjUeoUchl, recmdRVGzVZWVywBI, rec7j9tyH4EV9L9yd, recaHXUIQkCQZUyup, rechlGvvxCYsaTIET, recYicOSoH1C4zLvj, recMfs72SD4T9XIhS, recBPC6hC5tkxmXSH, recG7gyGMLSfyNTqk, recDd6IqU5EonfaVX, recHqynf62exp8cDx, rec2NKnDuis64uMrk, rec0adRBithZ3BNoZ, recKhWFKEYKSFcikb, recqKvugcEkV4FDmK, reccgzcQs3ReCRZiN, recMKyXERMUqHM87O, rec7fGIf5CE8xyzYT, recYD8fyMs8TZaj9w, reccM1F6ztegvuj41, rec0P4s0n2NSp3UqE, recy0MwATPDhKLOrN, recaBIRD7TdktJy1h, rechZVptoLoPBWnwS, rec7xthCyBwFCl0Qq, recyxKyMXE1K8gaeJ, recne0RxZm9FEE305, recwgamjEzLJVzpEz, recpb33n6nhQXT7Xh, recQLul19pdsMEMa5, recPrRxp2N5ucxiKc, recDoZl3h8rr6rPAq, recfRDPRzCbSARqsV, rec4PQao4ZWMG3oOP, reciearroVg1iqMvW, reccLeZ2tn6hR6Vt5, rec4HrvbLeqCbpcjv, rec0A220UQOmaAQYx, reckufkoHv5oXa23I, recr3y3J8db5sR8PB, recyc1j7BQCd7ciZt"
recnt65WdXSqW8C0z,2025-06-26T15:28:21.000Z,"{""id"": ""usrdgG7vRV8iqukqL"", ""email"": ""keegankdolan@gmail.com"", ""name"": ""Keegan Dolan""}","Significant change, higher daily effort or time commitment",Begin 2x weekly strength training,"{""id"": ""usrdgG7vRV8iqukqL"", ""email"": ""keegankdolan@gmail.com"", ""name"": ""Keegan Dolan""}",2025-09-23T23:50:02.000Z,"recIRf5TBEMboKqVm, recyCjSxWdLGZfHwI, recqj8q9IIWoThFkG, recx4JdeaTZgIVoZ3, recAaYIO7j0kgDYbf, recrAMEvn6TQqpIMf, recq2dRUP4FLao9gd, recPgYrf87WKNpens, recTQU7jk4viGfM5L, reciAaUoOHZJUbefJ, recKLti4nzfTo8acc, recq2gsA68cq1kCeB, reckWMg3144Ab2593",L,"recVQp0KNTbbjhQ4H, recUosH9znhcJhhCp, recyUarhJUq9omEm2, recVQp0KNTbbjhQ4H, recVQp0KNTbbjhQ4H, recVQp0KNTbbjhQ4H, recVQp0KNTbbjhQ4H, recVQp0KNTbbjhQ4H, recyUarhJUq9omEm2, recVQp0KNTbbjhQ4H, recVQp0KNTbbjhQ4H, recVQp0KNTbbjhQ4H, recVQp0KNTbbjhQ4H","recMiDba4KdZho45D, recC3HYOpjcuSTlGZ, recuKwwqbOncMVjuX, recBv7jvDZq4Bz29k, recv1aKMQckEj3mWw, recEBmO5Apr89hClw, recutBXbia6z32Nqu, recTHmxwBdnyG3SxJ, recXhidANaW6zTqf2, recm1y0FhNqxNPSp0, recutEyRzeDeUYgoS, reconamkuavo4GJjk"
recFXIwMZabd3UrDY,2025-06-26T15:28:22.000Z,"{""id"": ""usrdgG7vRV8iqukqL"", ""email"": ""keegankdolan@gmail.com"", ""name"": ""Keegan Dolan""}","Major lifestyle shift, high discipline, planning, or time",Daily Zone 2 cardio for 45 minutes,"{""id"": ""usrdgG7vRV8iqukqL"", ""email"": ""keegankdolan@gmail.com"", ""name"": ""Keegan Dolan""}",2025-06-26T15:38:27.000Z,,XL,,
