recWaxSdkoYowWptr,2025-06-04T23:56:39.000Z,"{""id"": ""usrdgG7vRV8iqukqL"", ""email"": ""keegankdolan@gmail.com"", ""name"": ""Keegan Dolan""}",PEP004-SINGLE,"recwtXkPSEQgyddmt, recierVNozpgZdLZH","recyKRTIlX4Jux2W0, recVHWlB26jWt9Ij9, recxJqmq5ipZMLJsj, recXiq3Os05QJJki4, rec8o1wlo0olBMl8A","{""id"": ""usrdgG7vRV8iqukqL"", ""email"": ""keegankdolan@gmail.com"", ""name"": ""Keegan Dolan""}",2025-09-27T17:33:46.000Z,"recRm2ApbeBAGkRR3, rec4Dopelk5bwlWhp, recJkpz67yD45h0d5, rec1QjfWhAnvBCLBH",,"Promotes rapid tendon, ligament, and gut healing, reduces inflammation. Useful for injury recovery and gut barrier support.",,,20,"recwtXkPSEQgyddmt, recierVNozpgZdLZH","recVHWlB26jWt9Ij9, recXiq3Os05QJJki4, rec8o1wlo0olBMl8A, recyKRTIlX4Jux2W0, recxJqmq5ipZMLJsj",,,"recAdUWMgWMZS3qKI, recUkIxIOnGBQsC1n, recAAuZFrdsqJW3yd",,rec7WMU4topbcodMF,150,21,Healing Peptide,500,250,250-500 µg,1,male_female,<>,Gastric pentadecapeptide for tissue repair,"Take 250-500mcg of BPC-157 on empty stomach daily for tissue repair, gut health, injury recovery, and systemic healing support",Empty stomach,PEP,rec0bCCIGsoIoxokH,µg,,,,,,,,,,,,,,,,,,,,,,,,,,,,,SINGLE,"Take 250-500mcg of BPC-157 on empty stomach daily for tissue repair, gut health, injury recovery, and systemic healing support",Gastric pentadecapeptide for tissue repair,PEP,004,BPC-157: Healing Peptide
recEt38gYzl5Uj7EX,2025-06-04T23:56:39.000Z,"{""id"": ""usrdgG7vRV8iqukqL"", ""email"": ""keegankdolan@gmail.com"", ""name"": ""Keegan Dolan""}",PEP005-SINGLE,,,"{""id"": ""usrdgG7vRV8iqukqL"", ""email"": ""keegankdolan@gmail.com"", ""name"": ""Keegan Dolan""}",2025-09-27T17:33:50.000Z,"recMC5jrkGqHlfSwv, recnOfXJOhXcqWRlh, recAJyQN5fsVxIQhx",,"Enhances tissue repair, angiogenesis, and wound healing. Frequently stacked with BPC-157 for difficult injuries or post-op.",,,15,,,,,"recierVNozpgZdLZH, recAdUWMgWMZS3qKI, recUkIxIOnGBQsC1n, recAAuZFrdsqJW3yd",,recexQanBHm8Pnf3e,150,21,Healing Peptide,5,2,2-5 mg,7,male_female,<>,Thymosin beta-4 fragment for tissue regeneration,"Take 2-5mg of TB-500 at any time weekly for tissue regeneration, injury recovery, cardiovascular health, and anti-inflammatory effects",Any,PEP,recBxCQOAdMmOV1Hi,mg,,,,,,,,,,,,,,,,,,,,,,,,,,,,,SINGLE,"Take 2-5mg of TB-500 at any time weekly for tissue regeneration, injury recovery, cardiovascular health, and anti-inflammatory effects",Thymosin beta-4 fragment for tissue regeneration,PEP,005,TB-500: Healing Peptide
recniL0lWjVJJokug,2025-06-04T23:56:39.000Z,"{""id"": ""usrdgG7vRV8iqukqL"", ""email"": ""keegankdolan@gmail.com"", ""name"": ""Keegan Dolan""}",PEP006-STACK,,,"{""id"": ""usrdgG7vRV8iqukqL"", ""email"": ""keegankdolan@gmail.com"", ""name"": ""Keegan Dolan""}",2025-09-27T17:59:45.000Z,"recjDcjOFVdna0Obz, recShlUPa5BzDuZC1, recApcukx2cgnxbka",,"Clinically synergistic stack for advanced healing of soft tissue, tendon, ligament, and muscle injuries. Used by top sports medicine clinics.",,,15,,,"Take 250-500mcg of BPC-157 (empty stomach daily) and 2-5mg of TB-500 (any time weekly) for accelerated tissue repair, injury recovery, gut health optimization, cardiovascular protection, and comprehensive healing support","Powerful healing peptide combination - BPC-157 promotes gut health and localized tissue repair while TB-500 enhances systemic tissue regeneration and cardiovascular health. Together they accelerate healing, reduce inflammation, and support comprehensive tissue maintenance.","recierVNozpgZdLZH, recAdUWMgWMZS3qKI, recUkIxIOnGBQsC1n, recAAuZFrdsqJW3yd",,rec7WMU4topbcodMF,150,21,Healing Peptide,500,250,250-500 µg,1,male_female,<>,Gastric pentadecapeptide for tissue repair,"Take 250-500mcg of BPC-157 on empty stomach daily for tissue repair, gut health, injury recovery, and systemic healing support",Empty stomach,PEP,rec0bCCIGsoIoxokH,µg,recexQanBHm8Pnf3e,150,21,Healing Peptide,5,2,2-5 mg,7,male_female,<>,Any,PEP,recBxCQOAdMmOV1Hi,mg,,,,,,,,,,,,,,,STACK,"Take 250-500mcg of BPC-157 (empty stomach daily) and 2-5mg of TB-500 (any time weekly) for accelerated tissue repair, injury recovery, gut health optimization, cardiovascular protection, and comprehensive healing support","Powerful healing peptide combination - BPC-157 promotes gut health and localized tissue repair while TB-500 enhances systemic tissue regeneration and cardiovascular health. Together they accelerate healing, reduce inflammation, and support comprehensive tissue maintenance.",PEP,006,BPC-157 + TB-500 Stack
recgKfnDcYPAgWKHE,2025-06-04T23:56:39.000Z,"{""id"": ""usrdgG7vRV8iqukqL"", ""email"": ""keegankdolan@gmail.com"", ""name"": ""Keegan Dolan""}",PEP007-SINGLE,,,"{""id"": ""usrdgG7vRV8iqukqL"", ""email"": ""keegankdolan@gmail.com"", ""name"": ""Keegan Dolan""}",2025-09-27T17:34:13.000Z,"recMC5jrkGqHlfSwv, recnOfXJOhXcqWRlh, recAJyQN5fsVxIQhx, recjDcjOFVdna0Obz, recShlUPa5BzDuZC1, recApcukx2cgnxbka, recgLINzrBvSzjc3r",,"Telomerase activator, shown to lengthen telomeres, restore circadian rhythms, and reduce cardiovascular/cancer mortality in older adults.",,,15,,,,,"recierVNozpgZdLZH, recAdUWMgWMZS3qKI, recUkIxIOnGBQsC1n, recAAuZFrdsqJW3yd",,recpDB5ecJ00WKTZW,150,21,Longevity Peptide,20,10,10-20 mg,1,male_female,<>,Telomerase activator for cellular aging,"Take 10-20mg of Epitalon before bed daily for telomerase activation, cellular aging reversal, circadian rhythm regulation, and longevity enhancement",Before bed,PEP,recBxCQOAdMmOV1Hi,mg,,,,,,,,,,,,,,,,,,,,,,,,,,,,,SINGLE,"Take 10-20mg of Epitalon before bed daily for telomerase activation, cellular aging reversal, circadian rhythm regulation, and longevity enhancement",Telomerase activator for cellular aging,PEP,007,Epitalon: Longevity Peptide
recapEFmJYjrL6jpK,2025-06-04T23:56:39.000Z,"{""id"": ""usrdgG7vRV8iqukqL"", ""email"": ""keegankdolan@gmail.com"", ""name"": ""Keegan Dolan""}",PEP008-SINGLE,,"recxJqmq5ipZMLJsj, recXiq3Os05QJJki4, rec8o1wlo0olBMl8A","{""id"": ""usrdgG7vRV8iqukqL"", ""email"": ""keegankdolan@gmail.com"", ""name"": ""Keegan Dolan""}",2025-09-27T17:34:18.000Z,,,Thymic peptide with immune-enhancing and possible longevity effects. Dramatic mortality reduction seen when stacked with Epitalon in human studies.,,,10,,"recXiq3Os05QJJki4, rec8o1wlo0olBMl8A, recxJqmq5ipZMLJsj",,,"recierVNozpgZdLZH, recAdUWMgWMZS3qKI, recUkIxIOnGBQsC1n, recAAuZFrdsqJW3yd",,recNlSRkXLfwq2IDp,150,21,Immune Peptide,10,5,5-10 mg,3,male_female,<>,Thymic peptide for immune system support,"Take 5-10mg of Thymalin at any time every 3 days for immune system optimization, thymic function restoration, and healthy aging",Any,PEP,recBxCQOAdMmOV1Hi,mg,,,,,,,,,,,,,,,,,,,,,,,,,,,,,SINGLE,"Take 5-10mg of Thymalin at any time every 3 days for immune system optimization, thymic function restoration, and healthy aging",Thymic peptide for immune system support,PEP,008,Thymalin: Immune Peptide
recTRaueW58CTs55v,2025-06-04T23:56:39.000Z,"{""id"": ""usrdgG7vRV8iqukqL"", ""email"": ""keegankdolan@gmail.com"", ""name"": ""Keegan Dolan""}",PEP009-STACK,,,"{""id"": ""usrdgG7vRV8iqukqL"", ""email"": ""keegankdolan@gmail.com"", ""name"": ""Keegan Dolan""}",2025-09-27T17:59:45.000Z,,,"Best-evidence human peptide stack for mortality reduction, immune rejuvenation, and healthy aging.",,,10,,,"Take 10-20mg of Epitalon (before bed daily) and 5-10mg of Thymalin (any time every 3 days) for telomerase activation, immune system restoration, circadian rhythm optimization, cellular aging reversal, and comprehensive longevity enhancement",Complementary peptides targeting cellular aging and immune function - Epitalon activates telomerase and regulates circadian rhythms while Thymalin restores thymic function and immune competence. Together they address two key pillars of healthy aging.,"recierVNozpgZdLZH, recAdUWMgWMZS3qKI, recUkIxIOnGBQsC1n, recAAuZFrdsqJW3yd",,recpDB5ecJ00WKTZW,150,21,Longevity Peptide,20,10,10-20 mg,1,male_female,<>,Telomerase activator for cellular aging,"Take 10-20mg of Epitalon before bed daily for telomerase activation, cellular aging reversal, circadian rhythm regulation, and longevity enhancement",Before bed,PEP,recBxCQOAdMmOV1Hi,mg,recNlSRkXLfwq2IDp,150,21,Immune Peptide,10,5,5-10 mg,3,male_female,<>,Any,PEP,recBxCQOAdMmOV1Hi,mg,,,,,,,,,,,,,,,STACK,"Take 10-20mg of Epitalon (before bed daily) and 5-10mg of Thymalin (any time every 3 days) for telomerase activation, immune system restoration, circadian rhythm optimization, cellular aging reversal, and comprehensive longevity enhancement",Complementary peptides targeting cellular aging and immune function - Epitalon activates telomerase and regulates circadian rhythms while Thymalin restores thymic function and immune competence. Together they address two key pillars of healthy aging.,PEP,009,Epitalon + Thymalin Stack
recKfsD4Kgd3T8dyJ,2025-06-04T23:56:39.000Z,"{""id"": ""usrdgG7vRV8iqukqL"", ""email"": ""keegankdolan@gmail.com"", ""name"": ""Keegan Dolan""}",PEP010-SINGLE,,,"{""id"": ""usrdgG7vRV8iqukqL"", ""email"": ""keegankdolan@gmail.com"", ""name"": ""Keegan Dolan""}",2025-09-27T17:34:36.000Z,,,"Mitochondrial peptide improving insulin sensitivity, energy, metabolic health. Early human data promising for frailty, metabolic syndrome.",,,10,,,,,"recierVNozpgZdLZH, recAdUWMgWMZS3qKI, recUkIxIOnGBQsC1n, recAAuZFrdsqJW3yd",,recGVkHpd317rez70,150,21,Mitochondrial Peptide,20,10,10-20 mg,3,male_female,<>,Mitochondrial-derived peptide for metabolism,"Take 10-20mg of MOTS-c in the morning every 3 days for mitochondrial function, metabolic optimization, exercise capacity, and longevity",Morning,PEP,recBxCQOAdMmOV1Hi,mg,,,,,,,,,,,,,,,,,,,,,,,,,,,,,SINGLE,"Take 10-20mg of MOTS-c in the morning every 3 days for mitochondrial function, metabolic optimization, exercise capacity, and longevity",Mitochondrial-derived peptide for metabolism,PEP,010,MOTS-c: Mitochondrial Peptide
recG9BmyzPJTCiHVE,2025-06-04T23:56:39.000Z,"{""id"": ""usrdgG7vRV8iqukqL"", ""email"": ""keegankdolan@gmail.com"", ""name"": ""Keegan Dolan""}",PEP011-SINGLE,,,"{""id"": ""usrdgG7vRV8iqukqL"", ""email"": ""keegankdolan@gmail.com"", ""name"": ""Keegan Dolan""}",2025-09-27T17:34:39.000Z,,,"Mitochondrial-derived peptide protecting neurons, enhancing insulin sensitivity, and showing longevity effects in animal studies.",,,10,,,,,"recierVNozpgZdLZH, recAdUWMgWMZS3qKI, recUkIxIOnGBQsC1n, recAAuZFrdsqJW3yd",,recKppKaieMXHdHtT,150,21,Mitochondrial Peptide,10,5,5-10 mg,3,male_female,<>,Neuroprotective mitochondrial peptide,"Take 5-10mg of Humanin at any time every 3 days for neuroprotection, mitochondrial health, cellular survival, and cognitive preservation",Any,PEP,recBxCQOAdMmOV1Hi,mg,,,,,,,,,,,,,,,,,,,,,,,,,,,,,SINGLE,"Take 5-10mg of Humanin at any time every 3 days for neuroprotection, mitochondrial health, cellular survival, and cognitive preservation",Neuroprotective mitochondrial peptide,PEP,011,Humanin: Mitochondrial Peptide
recKXlk5my5z2ItQq,2025-06-04T23:56:39.000Z,"{""id"": ""usrdgG7vRV8iqukqL"", ""email"": ""keegankdolan@gmail.com"", ""name"": ""Keegan Dolan""}",PEP012-SINGLE,,,"{""id"": ""usrdgG7vRV8iqukqL"", ""email"": ""keegankdolan@gmail.com"", ""name"": ""Keegan Dolan""}",2025-09-27T17:34:45.000Z,,,"Copper peptide supporting skin healing, collagen synthesis, cognitive function, and DNA repair. Powerful for skin and recovery.",,,10,,,,,"recierVNozpgZdLZH, recAdUWMgWMZS3qKI, recUkIxIOnGBQsC1n, recAAuZFrdsqJW3yd",,rec2F3CbADWEuukbn,150,21,Copper Peptide,5,2,2-5 mg,1,male_female,<>,Tissue remodeling and wound healing peptide,"Take 2-5mg of GHK-Cu at any time daily for tissue remodeling, wound healing, skin health, and anti-aging benefits",Any,PEP,recBxCQOAdMmOV1Hi,mg,,,,,,,,,,,,,,,,,,,,,,,,,,,,,SINGLE,"Take 2-5mg of GHK-Cu at any time daily for tissue remodeling, wound healing, skin health, and anti-aging benefits",Tissue remodeling and wound healing peptide,PEP,012,GHK-Cu: Copper Peptide
recWVj4Mby0hWd2WX,2025-06-04T23:56:39.000Z,"{""id"": ""usrdgG7vRV8iqukqL"", ""email"": ""keegankdolan@gmail.com"", ""name"": ""Keegan Dolan""}",PEP013-SINGLE,,,"{""id"": ""usrdgG7vRV8iqukqL"", ""email"": ""keegankdolan@gmail.com"", ""name"": ""Keegan Dolan""}",2025-09-27T17:34:50.000Z,,,"Mitochondrial-targeted peptide shown to boost energy, lower oxidative stress, and under clinical trials for aging, heart, and muscle.",,,10,,,,,"recierVNozpgZdLZH, recAdUWMgWMZS3qKI, recUkIxIOnGBQsC1n, recAAuZFrdsqJW3yd",,rec5IHG8JPx3cukaf,150,21,Mitochondrial Peptide,20,5,5-20 mg,1,male_female,<>,Mitochondrial-targeted antioxidant peptide,"Take 5-20mg of SS-31 at any time daily for mitochondrial protection, cellular energy optimization, and cardioprotection",Any,PEP,recBxCQOAdMmOV1Hi,mg,,,,,,,,,,,,,,,,,,,,,,,,,,,,,SINGLE,"Take 5-20mg of SS-31 at any time daily for mitochondrial protection, cellular energy optimization, and cardioprotection",Mitochondrial-targeted antioxidant peptide,PEP,013,SS-31: Mitochondrial Peptide
recILoTSc1W8sEfls,2025-06-04T23:56:39.000Z,"{""id"": ""usrdgG7vRV8iqukqL"", ""email"": ""keegankdolan@gmail.com"", ""name"": ""Keegan Dolan""}",PEP014-SINGLE,,,"{""id"": ""usrdgG7vRV8iqukqL"", ""email"": ""keegankdolan@gmail.com"", ""name"": ""Keegan Dolan""}",2025-09-27T17:34:54.000Z,,,"FDA-approved for HIV-related lipodystrophy, reduces visceral fat, sometimes used off-label for metabolic syndrome in aging.",,,10,,,,,"recierVNozpgZdLZH, recAdUWMgWMZS3qKI, recUkIxIOnGBQsC1n, recAAuZFrdsqJW3yd",,recKY3IY1AMFEiqzo,150,21,Growth Hormone Peptide,2,1,1-2 mg,1,male_female,<>,GHRH analog for body composition,"Take 1-2mg of Tesamorelin before bed daily for visceral fat reduction, body composition optimization, and metabolic health",Before bed,PEP,recBxCQOAdMmOV1Hi,mg,,,,,,,,,,,,,,,,,,,,,,,,,,,,,SINGLE,"Take 1-2mg of Tesamorelin before bed daily for visceral fat reduction, body composition optimization, and metabolic health",GHRH analog for body composition,PEP,014,Tesamorelin: Growth Hormone Peptide
recg47C0MjDA9cFAY,2025-06-04T23:56:39.000Z,"{""id"": ""usrdgG7vRV8iqukqL"", ""email"": ""keegankdolan@gmail.com"", ""name"": ""Keegan Dolan""}",PEP015-SINGLE,"receYj9nbAEGPBxFl, recDBJLAkc5CAfBm3","recoiAahhmbWcaNoa, recELBnyZAf0mIQH6, recSy02sgRnjfOkHE","{""id"": ""usrdgG7vRV8iqukqL"", ""email"": ""keegankdolan@gmail.com"", ""name"": ""Keegan Dolan""}",2025-09-27T17:35:00.000Z,,,"Immunomodulatory peptide for immune support in chronic infection, immunodeficiency, and possibly longevity.",receYj9nbAEGPBxFl,"recSy02sgRnjfOkHE, recELBnyZAf0mIQH6",15,recDBJLAkc5CAfBm3,recoiAahhmbWcaNoa,,,"recierVNozpgZdLZH, recAdUWMgWMZS3qKI, recUkIxIOnGBQsC1n, recAAuZFrdsqJW3yd",,recyjeOoGSOtTV5DA,150,21,Immune Peptide,3.2,1.6,1.6-3.2 mg,3,male_female,<>,Immunomodulatory peptide for immune enhancement,"Take 1.6-3.2mg of Thymosin Alpha-1 at any time every 3 days for immune enhancement, viral resistance, and longevity support",Any,PEP,recBxCQOAdMmOV1Hi,mg,,,,,,,,,,,,,,,,,,,,,,,,,,,,,SINGLE,"Take 1.6-3.2mg of Thymosin Alpha-1 at any time every 3 days for immune enhancement, viral resistance, and longevity support",Immunomodulatory peptide for immune enhancement,PEP,015,Thymosin Alpha-1: Immune Peptide
recR9fwZUUbMvSt2V,2025-06-04T23:56:39.000Z,"{""id"": ""usrdgG7vRV8iqukqL"", ""email"": ""keegankdolan@gmail.com"", ""name"": ""Keegan Dolan""}",PEP016-SINGLE,,,"{""id"": ""usrdgG7vRV8iqukqL"", ""email"": ""keegankdolan@gmail.com"", ""name"": ""Keegan Dolan""}",2025-09-27T17:35:06.000Z,,,"Potent stimulator of melanin, used for tanning and libido. Safety/efficacy for anti-aging not established; experimental.",,,10,,,,,"recierVNozpgZdLZH, recAdUWMgWMZS3qKI, recUkIxIOnGBQsC1n, recAAuZFrdsqJW3yd",,recJCh7hB4O9XeECD,150,21,Peptide Hormone,1,0.25,0.25-1 mg,1,male_female,<>,Melanocortin receptor agonist for skin protection,"Take 0.25-1mg of Melanotan II before bed daily for skin protection, melanin production, and potential metabolic benefits",Before bed,PEP,recBxCQOAdMmOV1Hi,mg,,,,,,,,,,,,,,,,,,,,,,,,,,,,,SINGLE,"Take 0.25-1mg of Melanotan II before bed daily for skin protection, melanin production, and potential metabolic benefits",Melanocortin receptor agonist for skin protection,PEP,016,Melanotan II: Peptide Hormone
rec9hiupXO4YxRDli,2025-06-04T23:56:39.000Z,"{""id"": ""usrdgG7vRV8iqukqL"", ""email"": ""keegankdolan@gmail.com"", ""name"": ""Keegan Dolan""}",PEP017-SINGLE,,,"{""id"": ""usrdgG7vRV8iqukqL"", ""email"": ""keegankdolan@gmail.com"", ""name"": ""Keegan Dolan""}",2025-09-27T17:35:11.000Z,,,Experimental senolytic peptide designed to clear senescent cells; animal and early human data suggest potential to rejuvenate tissues.,,,5,,,,,"recierVNozpgZdLZH, recAdUWMgWMZS3qKI, recUkIxIOnGBQsC1n, recAAuZFrdsqJW3yd",,recPwH0tLzPqgthYz,150,21,Senolytic Peptide,10,5,5-10 mg,30,male_female,<>,Senescent cell elimination peptide,"Take 5-10mg of FOXO4-DRI at any time monthly for senescent cell elimination, tissue rejuvenation, and healthy aging",Any,PEP,recBxCQOAdMmOV1Hi,mg,,,,,,,,,,,,,,,,,,,,,,,,,,,,,SINGLE,"Take 5-10mg of FOXO4-DRI at any time monthly for senescent cell elimination, tissue rejuvenation, and healthy aging",Senescent cell elimination peptide,PEP,017,FOXO4-DRI: Senolytic Peptide
recBI4DoR3OMeTOwC,2025-06-04T23:56:39.000Z,"{""id"": ""usrdgG7vRV8iqukqL"", ""email"": ""keegankdolan@gmail.com"", ""name"": ""Keegan Dolan""}",PEP018-SINGLE,,,"{""id"": ""usrdgG7vRV8iqukqL"", ""email"": ""keegankdolan@gmail.com"", ""name"": ""Keegan Dolan""}",2025-09-27T17:35:15.000Z,,,"Selank is a synthetic peptide shown to reduce anxiety, improve stress resilience, and enhance mental clarity and focus. Clinical use is growing for supporting mood, cognitive performance, and quality of life.",,,10,,,,,"recierVNozpgZdLZH, recAdUWMgWMZS3qKI, recUkIxIOnGBQsC1n, recAAuZFrdsqJW3yd",,recOOLSeSVblpHOK0,150,21,Nootropic Peptide,1.5,0.5,0.5-1.5 mg,1,male_female,<>,Anxiolytic peptide for stress and cognition,"Take 0.5-1.5mg of Selank in the morning daily for stress reduction, cognitive enhancement, immune modulation, and neuroprotection",Morning,PEP,recBxCQOAdMmOV1Hi,mg,,,,,,,,,,,,,,,,,,,,,,,,,,,,,SINGLE,"Take 0.5-1.5mg of Selank in the morning daily for stress reduction, cognitive enhancement, immune modulation, and neuroprotection",Anxiolytic peptide for stress and cognition,PEP,018,Selank: Nootropic Peptide
rece4LqhrZMUfGr0W,2025-06-04T23:56:39.000Z,"{""id"": ""usrdgG7vRV8iqukqL"", ""email"": ""keegankdolan@gmail.com"", ""name"": ""Keegan Dolan""}",PEP019-SINGLE,,,"{""id"": ""usrdgG7vRV8iqukqL"", ""email"": ""keegankdolan@gmail.com"", ""name"": ""Keegan Dolan""}",2025-09-27T17:35:18.000Z,,,"Semax is a neuropeptide with evidence for supporting brain function, focus, learning, and memory, as well as recovery from brain injury or stroke. Users may notice improved mental sharpness and cognitive endurance.",,,10,,,,,"recierVNozpgZdLZH, recAdUWMgWMZS3qKI, recUkIxIOnGBQsC1n, recAAuZFrdsqJW3yd",,recRCaqeqcfeiHKr5,150,21,Nootropic Peptide,1,0.2,0.2-1 mg,1,male_female,<>,Cognitive enhancement and neuroprotection,"Take 0.2-1mg of Semax in the morning daily for cognitive enhancement, neuroprotection, memory improvement, and brain health",Morning,PEP,recBxCQOAdMmOV1Hi,mg,,,,,,,,,,,,,,,,,,,,,,,,,,,,,SINGLE,"Take 0.2-1mg of Semax in the morning daily for cognitive enhancement, neuroprotection, memory improvement, and brain health",Cognitive enhancement and neuroprotection,PEP,019,Semax: Nootropic Peptide
recIHQ9b8Jw3zFcd3,2025-06-04T23:56:39.000Z,"{""id"": ""usrdgG7vRV8iqukqL"", ""email"": ""keegankdolan@gmail.com"", ""name"": ""Keegan Dolan""}",PEP020-SINGLE,,,"{""id"": ""usrdgG7vRV8iqukqL"", ""email"": ""keegankdolan@gmail.com"", ""name"": ""Keegan Dolan""}",2025-09-27T17:35:21.000Z,,,"Kisspeptin stimulates natural sex hormone production and may support healthy aging in those with hormone deficiency or imbalance. Most evidence is for fertility, but some benefit may extend to energy, libido, and mood.",,,10,,,,,"recierVNozpgZdLZH, recAdUWMgWMZS3qKI, recUkIxIOnGBQsC1n, recAAuZFrdsqJW3yd",,rece54HLMbtsbuZlu,150,21,Reproductive Peptide,5,1,1-5 µg,1,male_female,<>,Gonadotropin-releasing hormone stimulator,Take 1-5mcg of Kisspeptin at any time daily for reproductive health optimization and hormonal balance,Any,PEP,rec0bCCIGsoIoxokH,µg,,,,,,,,,,,,,,,,,,,,,,,,,,,,,SINGLE,Take 1-5mcg of Kisspeptin at any time daily for reproductive health optimization and hormonal balance,Gonadotropin-releasing hormone stimulator,PEP,020,Kisspeptin: Reproductive Peptide
recKbx33jkfn7s03A,2025-06-04T23:56:39.000Z,"{""id"": ""usrdgG7vRV8iqukqL"", ""email"": ""keegankdolan@gmail.com"", ""name"": ""Keegan Dolan""}",PEP021-SINGLE,,,"{""id"": ""usrdgG7vRV8iqukqL"", ""email"": ""keegankdolan@gmail.com"", ""name"": ""Keegan Dolan""}",2025-09-27T17:35:28.000Z,,,"Tesofensine is an appetite suppressant studied for obesity and weight loss. Some users also report improved motivation and energy, but it is not a direct longevity or cognitive enhancer.",,,10,,,,,"recierVNozpgZdLZH, recAdUWMgWMZS3qKI, recUkIxIOnGBQsC1n, recAAuZFrdsqJW3yd",,recZ6ewDohnArCowv,150,21,Weight Loss Drug,0.5,0.25,0.25-0.5 mg,1,male_female,<>,Triple reuptake inhibitor for body composition,"Take 0.25-0.5mg of Tesofensine in the morning daily for body composition optimization, metabolic enhancement, and weight management",Morning,PEP,recBxCQOAdMmOV1Hi,mg,,,,,,,,,,,,,,,,,,,,,,,,,,,,,SINGLE,"Take 0.25-0.5mg of Tesofensine in the morning daily for body composition optimization, metabolic enhancement, and weight management",Triple reuptake inhibitor for body composition,PEP,021,Tesofensine: Weight Loss Drug
recHVDGLzTS8NrPOi,2025-06-04T23:56:39.000Z,"{""id"": ""usrdgG7vRV8iqukqL"", ""email"": ""keegankdolan@gmail.com"", ""name"": ""Keegan Dolan""}",PEP022-SINGLE,,,"{""id"": ""usrdgG7vRV8iqukqL"", ""email"": ""keegankdolan@gmail.com"", ""name"": ""Keegan Dolan""}",2025-09-27T17:35:32.000Z,,,"LL-37 is a natural antimicrobial peptide that supports immune defense, speeds wound healing, and may help those at risk of recurrent infections or slow tissue recovery. Not a longevity agent, but relevant for infection resilience and healing.",,,10,,,,,"recierVNozpgZdLZH, recAdUWMgWMZS3qKI, recUkIxIOnGBQsC1n, recAAuZFrdsqJW3yd",,recd6TiMhFYv18aOI,150,21,Antimicrobial Peptide,5,2,2-5 mg,3,male_female,<>,Human cathelicidin for immune defense,"Take 2-5mg of LL-37 at any time every 3 days for immune defense, antimicrobial protection, and wound healing",Any,PEP,recBxCQOAdMmOV1Hi,mg,,,,,,,,,,,,,,,,,,,,,,,,,,,,,SINGLE,"Take 2-5mg of LL-37 at any time every 3 days for immune defense, antimicrobial protection, and wound healing",Human cathelicidin for immune defense,PEP,022,LL-37: Antimicrobial Peptide
recvfW5RJ1bA5UJUT,2025-06-04T23:56:39.000Z,"{""id"": ""usrdgG7vRV8iqukqL"", ""email"": ""keegankdolan@gmail.com"", ""name"": ""Keegan Dolan""}",PEP023-SINGLE,,,"{""id"": ""usrdgG7vRV8iqukqL"", ""email"": ""keegankdolan@gmail.com"", ""name"": ""Keegan Dolan""}",2025-09-27T17:35:35.000Z,,,IGF-1 LR3 is a powerful growth factor peptide used to stimulate muscle growth in cases of severe deficiency or wasting. Not for general use—risks include cancer promotion; limited to rare clinical scenarios.,,,10,,,,,"recierVNozpgZdLZH, recAdUWMgWMZS3qKI, recUkIxIOnGBQsC1n, recAAuZFrdsqJW3yd",,recDdXb8gmNlkmaLw,150,21,Growth Factor,50,20,20-50 µg,3,male_female,<>,Long-acting insulin-like growth factor,"Take 20-50mcg of IGF-1 LR3 in the morning every 3 days for muscle preservation, tissue repair, and anti-aging benefits",Morning,PEP,rec0bCCIGsoIoxokH,µg,,,,,,,,,,,,,,,,,,,,,,,,,,,,,SINGLE,"Take 20-50mcg of IGF-1 LR3 in the morning every 3 days for muscle preservation, tissue repair, and anti-aging benefits",Long-acting insulin-like growth factor,PEP,023,IGF-1 LR3: Growth Factor
recp2mgJzDwDJCGRI,2025-06-04T23:56:39.000Z,"{""id"": ""usrdgG7vRV8iqukqL"", ""email"": ""keegankdolan@gmail.com"", ""name"": ""Keegan Dolan""}",PEP024-SINGLE,,,"{""id"": ""usrdgG7vRV8iqukqL"", ""email"": ""keegankdolan@gmail.com"", ""name"": ""Keegan Dolan""}",2025-09-27T17:35:44.000Z,,,MGF is a variant of IGF-1 used experimentally to promote muscle repair after injury or severe sarcopenia. No strong evidence for general aging or longevity use; reserved for medical indications.,,,10,,,,,"recierVNozpgZdLZH, recAdUWMgWMZS3qKI, recUkIxIOnGBQsC1n, recAAuZFrdsqJW3yd",,reclFjQSn2XlvZr3H,150,21,Growth Factor,200,100,100-200 µg,3,male_female,<>,Mechano-growth factor for muscle maintenance,"Take 100-200mcg of MGF at any time every 3 days for muscle maintenance, recovery enhancement, and tissue regeneration",Any,PEP,rec0bCCIGsoIoxokH,µg,,,,,,,,,,,,,,,,,,,,,,,,,,,,,SINGLE,"Take 100-200mcg of MGF at any time every 3 days for muscle maintenance, recovery enhancement, and tissue regeneration",Mechano-growth factor for muscle maintenance,PEP,024,MGF: Growth Factor
recXhaC4ADP9RrHko,2025-06-04T23:56:39.000Z,"{""id"": ""usrdgG7vRV8iqukqL"", ""email"": ""keegankdolan@gmail.com"", ""name"": ""Keegan Dolan""}",MED001(i)-SINGLE,,,"{""id"": ""usrdgG7vRV8iqukqL"", ""email"": ""keegankdolan@gmail.com"", ""name"": ""Keegan Dolan""}",2025-09-27T17:36:19.000Z,,(i),"Statins lower LDL cholesterol, reduce cardiovascular events, stabilize plaque, and reduce inflammation (hsCRP). They are first-line for ASCVD, diabetes, or high LDL resistant to lifestyle/supplement interventions.",,,10,,,,,"recierVNozpgZdLZH, recAdUWMgWMZS3qKI, recUkIxIOnGBQsC1n, recAAuZFrdsqJW3yd",,rec0AvsGhSkxlnHX8,150,21,Statin,40,10,10-40 mg,1,male_female,<>,HMG-CoA reductase inhibitor for cardiovascular protection,"Take 10-40mg of Atorvastatin before bed daily for cardiovascular protection, cholesterol optimization, and potential longevity benefits",Before bed,MED,recBxCQOAdMmOV1Hi,mg,,,,,,,,,,,,,,,,,,,,,,,,,,,,,SINGLE,"Take 10-40mg of Atorvastatin before bed daily for cardiovascular protection, cholesterol optimization, and potential longevity benefits",HMG-CoA reductase inhibitor for cardiovascular protection,MED,001,Atorvastatin: Statin
