recRu57EJ7T4zhB2h,2025-06-04T23:56:39.000Z,"{""id"": ""usrdgG7vRV8iqukqL"", ""email"": ""keegankdolan@gmail.com"", ""name"": ""Keegan Dolan""}",SUP015-SINGLE,"recierVNozpgZdLZH, recAdUWMgWMZS3qKI, recf4HtvFUqMhyhdh, recPiW3K4dhWi31Xh, recq0JX3QgFBo5mm4, receYj9nbAEGPBxFl, recwtXkPSEQgyddmt",,"{""id"": ""usrdgG7vRV8iqukqL"", ""email"": ""keegankdolan@gmail.com"", ""name"": ""Keegan Dolan""}",2025-09-27T17:22:37.000Z,"rec1j4kGtt8DMLYFO, rec2XXB7INamQ3S4Z, recFarchexVbsWqcV, recMxvJCgtrra5ier",,"NAC is a precursor to glutathione (the body’s master antioxidant), supporting detoxification, liver, and respiratory health, especially for NAFLD or chronic lung disease.",receYj9nbAEGPBxFl,,25,"recwtXkPSEQgyddmt, recf4HtvFUqMhyhdh, recierVNozpgZdLZH, recq0JX3QgFBo5mm4, recAdUWMgWMZS3qKI, recPiW3K4dhWi31Xh",,,,"recUkIxIOnGBQsC1n, recAAuZFrdsqJW3yd",,rec0c2PPz0pcZocRm,150,21,Supplement,2400,1200,1200-2400 mg,1,male_female,<>,Antioxidant precursor for glutathione synthesis,"Take 1,200-2,400mg of NAC on empty stomach daily for glutathione production, liver detoxification, respiratory health, and cellular protection",Empty stomach,SUP,recBxCQOAdMmOV1Hi,mg,,,,,,,,,,,,,,,,,,,,,,,,,,,,,SINGLE,"Take 1,200-2,400mg of NAC on empty stomach daily for glutathione production, liver detoxification, respiratory health, and cellular protection",Antioxidant precursor for glutathione synthesis,SUP,015,NAC: Supplement
rec7MU52EslZT1jUt,2025-06-04T23:56:39.000Z,"{""id"": ""usrdgG7vRV8iqukqL"", ""email"": ""keegankdolan@gmail.com"", ""name"": ""Keegan Dolan""}",SUP016-SINGLE,"recf4HtvFUqMhyhdh, recC0mB1LyNGjDyld, recierVNozpgZdLZH, recAdUWMgWMZS3qKI, recDBJLAkc5CAfBm3, recq0JX3QgFBo5mm4, recw2hqgZfllcjFso","reccxH7AESy9vvBPo, recbIfUESzC18eAIL, recELBnyZAf0mIQH6, recSy02sgRnjfOkHE","{""id"": ""usrdgG7vRV8iqukqL"", ""email"": ""keegankdolan@gmail.com"", ""name"": ""Keegan Dolan""}",2025-09-27T17:22:41.000Z,"recMD0Aty33OBhyak, recjSzlhtOL89izWO, rec25h3FHNaUByXvS, rec70UQYyfpxpDmNQ",,"Berberine improves glucose and lipid metabolism, supports gut health, and may lower liver fat and A1c in metabolic syndrome, diabetes, and PCOS.","recC0mB1LyNGjDyld, recw2hqgZfllcjFso","recSy02sgRnjfOkHE, recELBnyZAf0mIQH6",30,"recf4HtvFUqMhyhdh, recierVNozpgZdLZH, recq0JX3QgFBo5mm4, recAdUWMgWMZS3qKI, recDBJLAkc5CAfBm3","reccxH7AESy9vvBPo, recbIfUESzC18eAIL",,,"recUkIxIOnGBQsC1n, recAAuZFrdsqJW3yd",,recA2z7KPT9LVQVQv,150,21,Supplement,1500,500,500-1500 mg,1,male_female,<>,Plant alkaloid for glucose metabolism,"Take 500-1,500mg of Berberine before meals daily for glucose metabolism, insulin sensitivity, cholesterol management, and gut health",Before meals,SUP,recBxCQOAdMmOV1Hi,mg,,,,,,,,,,,,,,,,,,,,,,,,,,,,,SINGLE,"Take 500-1,500mg of Berberine before meals daily for glucose metabolism, insulin sensitivity, cholesterol management, and gut health",Plant alkaloid for glucose metabolism,SUP,016,Berberine: Supplement
recDhLwBE8RhFpcMX,2025-06-04T23:56:39.000Z,"{""id"": ""usrdgG7vRV8iqukqL"", ""email"": ""keegankdolan@gmail.com"", ""name"": ""Keegan Dolan""}",SUP017-SINGLE,"recierVNozpgZdLZH, recf4HtvFUqMhyhdh, receYj9nbAEGPBxFl, recq0JX3QgFBo5mm4, recDBJLAkc5CAfBm3, recPiW3K4dhWi31Xh, recwtXkPSEQgyddmt","recxJqmq5ipZMLJsj, recXiq3Os05QJJki4, rec8o1wlo0olBMl8A","{""id"": ""usrdgG7vRV8iqukqL"", ""email"": ""keegankdolan@gmail.com"", ""name"": ""Keegan Dolan""}",2025-09-27T17:22:46.000Z,"recL9srK0ySlyshNB, recybnvVRi3uqaDzK, recKakSWF3VgxvkAY, recZZu138im52nLvU",,"Glycine is an amino acid that improves sleep latency, supports liver detox, and may improve metabolic and cardiovascular health, especially in metabolic syndrome or NAFLD.",receYj9nbAEGPBxFl,,25,"recwtXkPSEQgyddmt, recf4HtvFUqMhyhdh, recierVNozpgZdLZH, recq0JX3QgFBo5mm4, recPiW3K4dhWi31Xh, recDBJLAkc5CAfBm3","recXiq3Os05QJJki4, rec8o1wlo0olBMl8A, recxJqmq5ipZMLJsj",,,"recAdUWMgWMZS3qKI, recUkIxIOnGBQsC1n, recAAuZFrdsqJW3yd",,recpEJqsYV8mndsX2,150,21,Supplement,10,3,3-10 g,1,male_female,<>,Amino acid for sleep and collagen synthesis,"Take 3-10g of Glycine before bed daily for sleep quality, collagen synthesis, detoxification, and neuroprotection",Before bed,SUP,recBuF3n8IQ2v0Io8,g,,,,,,,,,,,,,,,,,,,,,,,,,,,,,SINGLE,"Take 3-10g of Glycine before bed daily for sleep quality, collagen synthesis, detoxification, and neuroprotection",Amino acid for sleep and collagen synthesis,SUP,017,Glycine: Supplement
recWO0nU7IeD7SHi9,2025-06-04T23:56:39.000Z,"{""id"": ""usrdgG7vRV8iqukqL"", ""email"": ""keegankdolan@gmail.com"", ""name"": ""Keegan Dolan""}",SUP018-STACK,"recPiW3K4dhWi31Xh, recf4HtvFUqMhyhdh",,"{""id"": ""usrdgG7vRV8iqukqL"", ""email"": ""keegankdolan@gmail.com"", ""name"": ""Keegan Dolan""}",2025-09-27T17:59:45.000Z,"recixL7mBSTqhNkna, reckgmoubE1WPxWuX, rech0uhKe0jdMkr5I, recWPLJxRelJSVwCu",,"Glucosamine and chondroitin support joint structure, reduce osteoarthritis symptoms, and may slow cartilage loss progression.",,,20,"recf4HtvFUqMhyhdh, recPiW3K4dhWi31Xh",,"Take 1,500mg of Glucosamine and 800-1,200mg of Chondroitin with meals daily for comprehensive joint health, cartilage preservation, reduced inflammation, and long-term mobility maintenance",Complementary compounds for comprehensive cartilage support - glucosamine provides building blocks for cartilage synthesis while chondroitin maintains cartilage structure and joint lubrication. Combined they offer superior joint preservation and mobility maintenance.,"recierVNozpgZdLZH, recAdUWMgWMZS3qKI, recUkIxIOnGBQsC1n, recAAuZFrdsqJW3yd",,recpKTKsnCzTM8OHr,150,21,Supplement,,1500,1500 mg,1,male_female,=,Amino sugar for cartilage synthesis and joint health,"Take 1,500mg of Glucosamine with meals daily for joint health, cartilage preservation, and mobility maintenance",With meals,SUP,recBxCQOAdMmOV1Hi,mg,rec93DdXdepkea14Q,,,Supplement,1200,800,800-1200 mg,1,male_female,<>,With meals,SUP,recBxCQOAdMmOV1Hi,mg,,,,,,,,,,,,,,,STACK,"Take 1,500mg of Glucosamine and 800-1,200mg of Chondroitin with meals daily for comprehensive joint health, cartilage preservation, reduced inflammation, and long-term mobility maintenance",Complementary compounds for comprehensive cartilage support - glucosamine provides building blocks for cartilage synthesis while chondroitin maintains cartilage structure and joint lubrication. Combined they offer superior joint preservation and mobility maintenance.,SUP,018,Glucosamine + Chondroitin Stack
rec2jWRD3SItFiAWs,2025-06-04T23:56:39.000Z,"{""id"": ""usrdgG7vRV8iqukqL"", ""email"": ""keegankdolan@gmail.com"", ""name"": ""Keegan Dolan""}",SUP019-SINGLE,"recPiW3K4dhWi31Xh, recierVNozpgZdLZH, recAdUWMgWMZS3qKI, receYj9nbAEGPBxFl, recBA3iQ4lGJtC2nM, recw2hqgZfllcjFso, recq0JX3QgFBo5mm4, recwtXkPSEQgyddmt, recLJcUUTL1szyE8Z","recVHWlB26jWt9Ij9, reccxH7AESy9vvBPo, recbIfUESzC18eAIL","{""id"": ""usrdgG7vRV8iqukqL"", ""email"": ""keegankdolan@gmail.com"", ""name"": ""Keegan Dolan""}",2025-09-27T17:31:33.000Z,"recJ4vL5VemVMA5VN, recZzl80Pxwh2f6TC, recjIxKcwovfF1VuR, rechMscowZwnUBRGt",,"Curcumin (from turmeric) is anti-inflammatory and antioxidant, reducing joint pain, supporting mood, and metabolic health. Best absorbed with piperine/black pepper.","receYj9nbAEGPBxFl, recw2hqgZfllcjFso",,25,"recwtXkPSEQgyddmt, recierVNozpgZdLZH, recq0JX3QgFBo5mm4, recAdUWMgWMZS3qKI, recLJcUUTL1szyE8Z, recPiW3K4dhWi31Xh, recBA3iQ4lGJtC2nM","recVHWlB26jWt9Ij9, reccxH7AESy9vvBPo, recbIfUESzC18eAIL",,,"recUkIxIOnGBQsC1n, recAAuZFrdsqJW3yd",,recW8eoiiOpM0PwJ7,150,21,Supplement,2000,1000,1000-2000 mg,1,male_female,<>,Anti-inflammatory polyphenol from turmeric,"Take 1,000-2,000mg of Curcumin with meals daily for anti-inflammatory effects, antioxidant protection, brain health, and longevity pathways",With meals,SUP,recBxCQOAdMmOV1Hi,mg,,,,,,,,,,,,,,,,,,,,,,,,,,,,,SINGLE,"Take 1,000-2,000mg of Curcumin with meals daily for anti-inflammatory effects, antioxidant protection, brain health, and longevity pathways",Anti-inflammatory polyphenol from turmeric,SUP,019,Curcumin: Supplement
recjcAFH5st2aRDO0,2025-06-04T23:56:39.000Z,"{""id"": ""usrdgG7vRV8iqukqL"", ""email"": ""keegankdolan@gmail.com"", ""name"": ""Keegan Dolan""}",SUP020-SINGLE,"recPiW3K4dhWi31Xh, receYj9nbAEGPBxFl, recw2hqgZfllcjFso, recDBJLAkc5CAfBm3, recL8dpnjNSzBJp2L, recZd7qSsYU2dqSw0","recVHWlB26jWt9Ij9, recyKRTIlX4Jux2W0, recoiAahhmbWcaNoa","{""id"": ""usrdgG7vRV8iqukqL"", ""email"": ""keegankdolan@gmail.com"", ""name"": ""Keegan Dolan""}",2025-09-27T17:31:37.000Z,"recuhRGoqAdM1CeF8, recye1PIDZNSe8b5U, rec4SmFL2GdVOlSlQ, rec6SOq5JXWnOvyKH",,"Alpha-lipoic acid is an antioxidant that may support glucose metabolism and nerve health, especially in diabetes.","receYj9nbAEGPBxFl, recw2hqgZfllcjFso",,20,"recPiW3K4dhWi31Xh, recZd7qSsYU2dqSw0, recL8dpnjNSzBJp2L, recDBJLAkc5CAfBm3","recVHWlB26jWt9Ij9, recyKRTIlX4Jux2W0, recoiAahhmbWcaNoa",,,"recierVNozpgZdLZH, recAdUWMgWMZS3qKI, recUkIxIOnGBQsC1n, recAAuZFrdsqJW3yd",,recfcEpB9HeiAaTmR,150,21,Supplement,1200,600,600-1200 mg,1,male_female,<>,Antioxidant for metabolic and neurological health,"Take 600-1,200mg of Alpha-Lipoic Acid on empty stomach daily for antioxidant protection, glucose metabolism, neuroprotection, and mitochondrial health",Empty stomach,SUP,recBxCQOAdMmOV1Hi,mg,,,,,,,,,,,,,,,,,,,,,,,,,,,,,SINGLE,"Take 600-1,200mg of Alpha-Lipoic Acid on empty stomach daily for antioxidant protection, glucose metabolism, neuroprotection, and mitochondrial health",Antioxidant for metabolic and neurological health,SUP,020,Alpha-Lipoic Acid: Supplement
recKNB8U7yjdesIaY,2025-06-04T23:56:39.000Z,"{""id"": ""usrdgG7vRV8iqukqL"", ""email"": ""keegankdolan@gmail.com"", ""name"": ""Keegan Dolan""}",SUP021-SINGLE,"receYj9nbAEGPBxFl, recw2hqgZfllcjFso, recDBJLAkc5CAfBm3, recPiW3K4dhWi31Xh",,"{""id"": ""usrdgG7vRV8iqukqL"", ""email"": ""keegankdolan@gmail.com"", ""name"": ""Keegan Dolan""}",2025-09-27T17:31:41.000Z,"recFQ42WZEgN3f2ad, recARnf0UAbHjKdXM, recHJRk5CkP0r2Z8M, recDBbUljCveQ3Fkm",,"Astaxanthin is a carotenoid antioxidant that may support skin, eye, and metabolic health. Human outcome evidence is limited.","receYj9nbAEGPBxFl, recw2hqgZfllcjFso",,20,"recPiW3K4dhWi31Xh, recDBJLAkc5CAfBm3",,,,"recierVNozpgZdLZH, recAdUWMgWMZS3qKI, recUkIxIOnGBQsC1n, recAAuZFrdsqJW3yd",,recIyuJ59M3dmzz2m,150,21,Supplement,24,8,8-24 mg,1,male_female,<>,Potent carotenoid antioxidant for eye/skin health,"Take 8-24mg of Astaxanthin with meals daily for powerful antioxidant protection, eye health, skin protection, and cardiovascular benefits",With meals,SUP,recBxCQOAdMmOV1Hi,mg,,,,,,,,,,,,,,,,,,,,,,,,,,,,,SINGLE,"Take 8-24mg of Astaxanthin with meals daily for powerful antioxidant protection, eye health, skin protection, and cardiovascular benefits",Potent carotenoid antioxidant for eye/skin health,SUP,021,Astaxanthin: Supplement
recJH0aBL1IvHnanZ,2025-06-04T23:56:39.000Z,"{""id"": ""usrdgG7vRV8iqukqL"", ""email"": ""keegankdolan@gmail.com"", ""name"": ""Keegan Dolan""}",SUP022-SINGLE,"receYj9nbAEGPBxFl, recPiW3K4dhWi31Xh",,"{""id"": ""usrdgG7vRV8iqukqL"", ""email"": ""keegankdolan@gmail.com"", ""name"": ""Keegan Dolan""}",2025-09-27T17:31:45.000Z,"recCeCFvuxsKWtuKQ, reciiD6NLX5kDO0oq, recAFagYc3JaYmpog, rec9cRiTfek7FNtol",,"Resveratrol, found in red wine, is linked to anti-inflammatory and metabolic benefits, but robust evidence in humans is limited.",receYj9nbAEGPBxFl,,20,recPiW3K4dhWi31Xh,,,,"recierVNozpgZdLZH, recAdUWMgWMZS3qKI, recUkIxIOnGBQsC1n, recAAuZFrdsqJW3yd",,recWJJi1sjsdwyYL8,150,21,Supplement,2000,500,500-2000 mg,1,male_female,<>,Polyphenol antioxidant for cardiovascular health,"Take 500-2,000mg of Resveratrol on empty stomach daily for cardiovascular health, longevity gene activation, anti-inflammatory effects, and neuroprotection",Empty stomach,SUP,recBxCQOAdMmOV1Hi,mg,,,,,,,,,,,,,,,,,,,,,,,,,,,,,SINGLE,"Take 500-2,000mg of Resveratrol on empty stomach daily for cardiovascular health, longevity gene activation, anti-inflammatory effects, and neuroprotection",Polyphenol antioxidant for cardiovascular health,SUP,022,Resveratrol: Supplement
recnToD6IHt3Ur7Nj,2025-06-04T23:56:39.000Z,"{""id"": ""usrdgG7vRV8iqukqL"", ""email"": ""keegankdolan@gmail.com"", ""name"": ""Keegan Dolan""}",SUP023-STACK,,,"{""id"": ""usrdgG7vRV8iqukqL"", ""email"": ""keegankdolan@gmail.com"", ""name"": ""Keegan Dolan""}",2025-09-27T17:59:45.000Z,"rec3sb24qz5xilbj0, recqfKbgd9Tv5mTKy, recjmtOqcZXelHrt9, rec9T72prUKfRLEdv",,"Lutein and zeaxanthin are carotenoids that support retinal and eye health, especially in older adults or those at risk for macular degeneration.",,,20,,,"Take 10-20mg of Lutein and 2-4mg of Zeaxanthin with meals daily for complete macular protection, blue light defense, visual performance optimization, and age-related eye disease prevention","Synergistic carotenoid antioxidants that concentrate in the macula for comprehensive eye protection. Together they filter harmful blue light, protect against oxidative damage, and support visual performance and long-term eye health.","recierVNozpgZdLZH, recAdUWMgWMZS3qKI, recUkIxIOnGBQsC1n, recAAuZFrdsqJW3yd",,recZDoACtBHOhNjyS,150,21,Supplement,20,10,10-20 mg,1,male_female,<>,Carotenoid antioxidant for macular and eye health,"Take 10-20mg of Lutein with meals daily for macular protection, eye health, and blue light defense",With meals,SUP,recBxCQOAdMmOV1Hi,mg,recXHyDB13wRRncug,,,Supplement,4,2,2-4 mg,1,male_female,<>,With meals,SUP,recBxCQOAdMmOV1Hi,mg,,,,,,,,,,,,,,,STACK,"Take 10-20mg of Lutein and 2-4mg of Zeaxanthin with meals daily for complete macular protection, blue light defense, visual performance optimization, and age-related eye disease prevention","Synergistic carotenoid antioxidants that concentrate in the macula for comprehensive eye protection. Together they filter harmful blue light, protect against oxidative damage, and support visual performance and long-term eye health.",SUP,023,Lutein + Zeaxanthin Stack
recuuog4s8LUmqwum,2025-09-22T19:49:14.000Z,"{""id"": ""usrdgG7vRV8iqukqL"", ""email"": ""keegankdolan@gmail.com"", ""name"": ""Keegan Dolan""}",SUP024-SINGLE,,,"{""id"": ""usrdgG7vRV8iqukqL"", ""email"": ""keegankdolan@gmail.com"", ""name"": ""Keegan Dolan""}",2025-09-27T17:32:10.000Z,,,"Ashwagandha is an adaptogen that may support stress resilience, sleep quality, and healthy cortisol levels. Evidence is promising for stress/anxiety reduction.",,,,,,,,,,recTULxGAG8iIXN8t,150,21,Supplement,1200,600,600-1200 mg,1,male_female,<>,Adaptogenic herb for stress and cortisol management,"Take 600-1,200mg of Ashwagandha with meals daily for stress reduction, cortisol management, sleep quality, and adaptogenic benefits",With meals,SUP,recBxCQOAdMmOV1Hi,mg,,,,,,,,,,,,,,,,,,,,,,,,,,,,,SINGLE,"Take 600-1,200mg of Ashwagandha with meals daily for stress reduction, cortisol management, sleep quality, and adaptogenic benefits",Adaptogenic herb for stress and cortisol management,SUP,024,Ashwagandha: Supplement
recRTk82CFFbZIZ9S,2025-06-04T23:56:39.000Z,"{""id"": ""usrdgG7vRV8iqukqL"", ""email"": ""keegankdolan@gmail.com"", ""name"": ""Keegan Dolan""}",SUP025-SINGLE,"recwtXkPSEQgyddmt, recPiW3K4dhWi31Xh, recL8dpnjNSzBJp2L, recX6IiQRem8pQ14z, recAm1sha0xsNnVoG, recdABLj65LlSCrvr, recntmFnf3bSSe2DB","recxJqmq5ipZMLJsj, recXiq3Os05QJJki4, rec8o1wlo0olBMl8A, recqea20SA5Y5BaIw","{""id"": ""usrdgG7vRV8iqukqL"", ""email"": ""keegankdolan@gmail.com"", ""name"": ""Keegan Dolan""}",2025-09-27T17:32:15.000Z,"recw8yD8LM00k1glh, recPcuHbt6EQljnTS, recgQFP6CsuqdN1pw",,Vitamin K2 supports bone and cardiovascular health by regulating calcium metabolism. Most important when taking vitamin D or for those at osteoporosis risk.,,,25,"recwtXkPSEQgyddmt, recntmFnf3bSSe2DB, recAm1sha0xsNnVoG, recX6IiQRem8pQ14z, recPiW3K4dhWi31Xh, recL8dpnjNSzBJp2L, recdABLj65LlSCrvr","recXiq3Os05QJJki4, recqea20SA5Y5BaIw, rec8o1wlo0olBMl8A, recxJqmq5ipZMLJsj",,,recwIwB9znK0kB3Xg,recLuAlDIETnvUUtO,recBUzFq2Pumf3A0F,150,21,Supplement,200,100,100-200 µg,1,male_female,<>,Fat-soluble vitamin for bone and cardiovascular health,"Take 100-200mcg of Vitamin K2 with meals daily for bone health, cardiovascular protection, and calcium metabolism optimization",With meals,SUP,rec0bCCIGsoIoxokH,µg,,,,,,,,,,,,,,,,,,,,,,,,,,,,,SINGLE,"Take 100-200mcg of Vitamin K2 with meals daily for bone health, cardiovascular protection, and calcium metabolism optimization",Fat-soluble vitamin for bone and cardiovascular health,SUP,025,Vitamin K2: Supplement
recBYWzN6FRmP1yFr,2025-06-04T23:56:39.000Z,"{""id"": ""usrdgG7vRV8iqukqL"", ""email"": ""keegankdolan@gmail.com"", ""name"": ""Keegan Dolan""}",SUP026-SINGLE,recPiW3K4dhWi31Xh,,"{""id"": ""usrdgG7vRV8iqukqL"", ""email"": ""keegankdolan@gmail.com"", ""name"": ""Keegan Dolan""}",2025-09-27T17:32:21.000Z,"recIHIxgXQE6NBA0m, recCzDXebED8MF9Od, recPXpZaBQ69ibIeQ, recTD6S0CoD3zysKD",,Niacin (vitamin B3) can lower LDL and triglycerides and raise HDL; used at high doses under clinical guidance for dyslipidemia.,,,25,recPiW3K4dhWi31Xh,,,,"recierVNozpgZdLZH, recAdUWMgWMZS3qKI, recUkIxIOnGBQsC1n, recAAuZFrdsqJW3yd",,recNIce5Dd6gMd1Gj,150,21,OTC Medication,1000,500,500-1000 mg,1,male_female,<>,B vitamin for cholesterol management,"Take 500-1,000mg of Niacin with meals daily for cholesterol management, NAD+ precursor benefits, and cardiovascular health",With meals,SUP,recBxCQOAdMmOV1Hi,mg,,,,,,,,,,,,,,,,,,,,,,,,,,,,,SINGLE,"Take 500-1,000mg of Niacin with meals daily for cholesterol management, NAD+ precursor benefits, and cardiovascular health",B vitamin for cholesterol management,SUP,026,Niacin: OTC Medication
recgHjOqTOirOfCmU,2025-06-04T23:56:39.000Z,"{""id"": ""usrdgG7vRV8iqukqL"", ""email"": ""keegankdolan@gmail.com"", ""name"": ""Keegan Dolan""}",SUP027-SINGLE,"receYj9nbAEGPBxFl, recPiW3K4dhWi31Xh, recw2hqgZfllcjFso, recDBJLAkc5CAfBm3","recELBnyZAf0mIQH6, recSy02sgRnjfOkHE","{""id"": ""usrdgG7vRV8iqukqL"", ""email"": ""keegankdolan@gmail.com"", ""name"": ""Keegan Dolan""}",2025-09-27T17:32:29.000Z,"recJYuPQsqxn4YQux, recUqZTwGYdWh20kp, rec4cF6tYEK95ruyo, recvPyTYk8n68PpL1",,Low-dose aspirin may reduce heart attack or stroke risk in some high-risk adults; not for general prevention without provider input.,"receYj9nbAEGPBxFl, recw2hqgZfllcjFso","recSy02sgRnjfOkHE, recELBnyZAf0mIQH6",25,"recPiW3K4dhWi31Xh, recDBJLAkc5CAfBm3",,,,"recierVNozpgZdLZH, recAdUWMgWMZS3qKI, recUkIxIOnGBQsC1n, recAAuZFrdsqJW3yd",,recQHvehcpqzOPO6r,150,21,OTC Medication,100,75,75-100 mg,1,male_female,<>,Antiplatelet therapy for cardiovascular protection,"Take 75-100mg of Low-Dose Aspirin with meals daily for cardiovascular protection, stroke prevention, and anti-inflammatory effects",With meals,SUP,recBxCQOAdMmOV1Hi,mg,,,,,,,,,,,,,,,,,,,,,,,,,,,,,SINGLE,"Take 75-100mg of Low-Dose Aspirin with meals daily for cardiovascular protection, stroke prevention, and anti-inflammatory effects",Antiplatelet therapy for cardiovascular protection,SUP,027,Low-Dose Aspirin: OTC Medication
rec7WBtHpMlUCtYtT,2025-06-04T23:56:39.000Z,"{""id"": ""usrdgG7vRV8iqukqL"", ""email"": ""keegankdolan@gmail.com"", ""name"": ""Keegan Dolan""}",PEP001-SINGLE,"recDUx81XNYUkBLRH, receYj9nbAEGPBxFl, recf4HtvFUqMhyhdh, recierVNozpgZdLZH, recPiW3K4dhWi31Xh",,"{""id"": ""usrdgG7vRV8iqukqL"", ""email"": ""keegankdolan@gmail.com"", ""name"": ""Keegan Dolan""}",2025-09-27T17:32:38.000Z,"recFBI5gaQoMCzBJD, recwyAHuSPh9Wym00, recHG33xSFrAb1gEd, recBq26uKb3AVSBC4",,"Dual GLP-1/GIP agonist for major glucose, weight, and cardiovascular risk reduction. Most potent class for obesity/metabolic syndrome.",receYj9nbAEGPBxFl,,35,"recf4HtvFUqMhyhdh, recierVNozpgZdLZH, recPiW3K4dhWi31Xh, recDUx81XNYUkBLRH",,,,"recAdUWMgWMZS3qKI, recUkIxIOnGBQsC1n, recAAuZFrdsqJW3yd",,recQAXH8yH8qixaIE,150,21,GLP/GIP Agonist,10,5,5-10 mg,7,male_female,<>,Dual incretin receptor agonist for metabolic health,"Take 5-10mg of Tirzepatide at any time weekly for metabolic optimization, weight management, insulin sensitivity, and potential longevity benefits",Any,PEP,recBxCQOAdMmOV1Hi,mg,,,,,,,,,,,,,,,,,,,,,,,,,,,,,SINGLE,"Take 5-10mg of Tirzepatide at any time weekly for metabolic optimization, weight management, insulin sensitivity, and potential longevity benefits",Dual incretin receptor agonist for metabolic health,PEP,001,Tirzepatide: GLP/GIP Agonist
recN0RQzSEzIQxBZE,2025-06-04T23:56:39.000Z,"{""id"": ""usrdgG7vRV8iqukqL"", ""email"": ""keegankdolan@gmail.com"", ""name"": ""Keegan Dolan""}",PEP002(i)-SINGLE,"recf4HtvFUqMhyhdh, recC0mB1LyNGjDyld, recierVNozpgZdLZH, recAdUWMgWMZS3qKI, receYj9nbAEGPBxFl, recBA3iQ4lGJtC2nM, recw2hqgZfllcjFso, recDBJLAkc5CAfBm3, recPiW3K4dhWi31Xh, recfQt6B5C5wmZDqn, recHHlPLn8pdw89yH, recyUWBp7cedeahQO, rec78IoEbAaGCIfPe, recRgCjpkw99U68vD, recuJaoMbqZ3GOYdw","reccxH7AESy9vvBPo, recbIfUESzC18eAIL, recyKRTIlX4Jux2W0, recELBnyZAf0mIQH6, recSy02sgRnjfOkHE, recoiAahhmbWcaNoa","{""id"": ""usrdgG7vRV8iqukqL"", ""email"": ""keegankdolan@gmail.com"", ""name"": ""Keegan Dolan""}",2025-09-27T17:32:50.000Z,"recHJ8X1mcBrbS4JZ, recOIkO2bz4xCm6yb, rec6NK7KjzP7sziwa",(i),"Lowers blood glucose, promotes weight loss, and reduces cardiovascular events; foundational for metabolic and cardiometabolic health.",recDBJLAkc5CAfBm3,,100,"recfQt6B5C5wmZDqn, receYj9nbAEGPBxFl, recHHlPLn8pdw89yH, recRgCjpkw99U68vD, recuJaoMbqZ3GOYdw, rec78IoEbAaGCIfPe, recyUWBp7cedeahQO, recf4HtvFUqMhyhdh, recierVNozpgZdLZH, recC0mB1LyNGjDyld, recAdUWMgWMZS3qKI, recPiW3K4dhWi31Xh, recw2hqgZfllcjFso, recBA3iQ4lGJtC2nM","recSy02sgRnjfOkHE, recELBnyZAf0mIQH6, reccxH7AESy9vvBPo, recbIfUESzC18eAIL, recyKRTIlX4Jux2W0, recoiAahhmbWcaNoa",,,recwIwB9znK0kB3Xg,recLuAlDIETnvUUtO,recq3J4Ps8fMpkwII,150,21,GLP-1 Agonist,2.4,1,1-2.4 mg,7,male_female,<>,Incretin mimetic for metabolic optimization,"Take 1-2.4mg of Semaglutide at any time weekly for metabolic health, weight optimization, cardiovascular protection, and neuroprotection",Any,PEP,recBxCQOAdMmOV1Hi,mg,,,,,,,,,,,,,,,,,,,,,,,,,,,,,SINGLE,"Take 1-2.4mg of Semaglutide at any time weekly for metabolic health, weight optimization, cardiovascular protection, and neuroprotection",Incretin mimetic for metabolic optimization,PEP,002,Semaglutide: GLP-1 Agonist
recLpKyJ2dam4PxO9,2025-09-27T17:32:53.000Z,"{""id"": ""usrdgG7vRV8iqukqL"", ""email"": ""keegankdolan@gmail.com"", ""name"": ""Keegan Dolan""}",PEP002(ii)-SINGLE,,,"{""id"": ""usrdgG7vRV8iqukqL"", ""email"": ""keegankdolan@gmail.com"", ""name"": ""Keegan Dolan""}",2025-09-27T17:33:14.000Z,,(ii),,,,,,,,,,,recmDsgoUwQ7BfmiF,150,21,GLP-1 Agonist,3,1.2,1.2-3 mg,1,male_female,<>,Incretin mimetic for metabolic optimization,"Take 1.2-3mg of Liraglutide at any time daily for metabolic optimization, appetite regulation, and cardiovascular benefits",Any,PEP,recBxCQOAdMmOV1Hi,mg,,,,,,,,,,,,,,,,,,,,,,,,,,,,,SINGLE,"Take 1.2-3mg of Liraglutide at any time daily for metabolic optimization, appetite regulation, and cardiovascular benefits",Incretin mimetic for metabolic optimization,PEP,002,Liraglutide: GLP-1 Agonist
rectSvR0DGkWchk46,2025-06-04T23:56:39.000Z,"{""id"": ""usrdgG7vRV8iqukqL"", ""email"": ""keegankdolan@gmail.com"", ""name"": ""Keegan Dolan""}",PEP003-STACK,"recf4HtvFUqMhyhdh, recC0mB1LyNGjDyld, recierVNozpgZdLZH, recAdUWMgWMZS3qKI, receYj9nbAEGPBxFl, recDBJLAkc5CAfBm3, recfQt6B5C5wmZDqn, recHHlPLn8pdw89yH, recPiW3K4dhWi31Xh, recyUWBp7cedeahQO","reccxH7AESy9vvBPo, recbIfUESzC18eAIL, recyKRTIlX4Jux2W0, recELBnyZAf0mIQH6, recSy02sgRnjfOkHE, recoiAahhmbWcaNoa","{""id"": ""usrdgG7vRV8iqukqL"", ""email"": ""keegankdolan@gmail.com"", ""name"": ""Keegan Dolan""}",2025-09-27T17:59:45.000Z,"reci85XjmgHjnCB9m, recDB0nqXJftzQi9R, recFcpuijUskcqZtV, recJIujgpWIaEhAAA, recUWOuxNHAntuSCB",,"Stacking GHRH analog (CJC-1295) and secretagogue (ipamorelin) mimics physiologic GH pulses, supporting muscle, recovery, and fat loss. Well-tolerated, often used in age-related GH decline.","receYj9nbAEGPBxFl, recC0mB1LyNGjDyld","recSy02sgRnjfOkHE, recELBnyZAf0mIQH6",100,"recfQt6B5C5wmZDqn, recHHlPLn8pdw89yH, recyUWBp7cedeahQO, recf4HtvFUqMhyhdh, recierVNozpgZdLZH, recAdUWMgWMZS3qKI, recPiW3K4dhWi31Xh, recDBJLAkc5CAfBm3","reccxH7AESy9vvBPo, recbIfUESzC18eAIL, recyKRTIlX4Jux2W0, recoiAahhmbWcaNoa","Take 100-200mcg of CJC-1295 (before bed) and 200-300mcg of Ipamorelin (empty stomach) every 3 days for natural growth hormone optimization, body composition improvement, enhanced recovery, muscle preservation, and metabolic benefits","Synergistic peptide combination that optimizes natural growth hormone release - CJC-1295 provides sustained GHRH stimulation while Ipamorelin offers pulsatile GHRP activation. Together they enhance body composition, recovery, and anti-aging benefits with minimal side effects.","recUkIxIOnGBQsC1n, recAAuZFrdsqJW3yd",,recrRDZRj2UTjX1Wc,150,21,Growth Hormone Peptide,200,100,100-200 µg,3,male_female,<>,GHRH analog for growth hormone optimization,"Take 100-200mcg of CJC-1295 before bed every 3 days for growth hormone optimization, muscle preservation, fat metabolism, and recovery enhancement",Before bed,PEP,rec0bCCIGsoIoxokH,µg,rec5W034jGhhONMRM,150,21,Growth Hormone Peptide,300,200,200-300 µg,3,male_female,<>,Empty stomach,PEP,rec0bCCIGsoIoxokH,µg,,,,,,,,,,,,,,,STACK,"Take 100-200mcg of CJC-1295 (before bed) and 200-300mcg of Ipamorelin (empty stomach) every 3 days for natural growth hormone optimization, body composition improvement, enhanced recovery, muscle preservation, and metabolic benefits","Synergistic peptide combination that optimizes natural growth hormone release - CJC-1295 provides sustained GHRH stimulation while Ipamorelin offers pulsatile GHRP activation. Together they enhance body composition, recovery, and anti-aging benefits with minimal side effects.",PEP,003,CJC-1295 + Ipamorelin Stack
