record_id,categorical_description_from_recommendations_v2,config_id,config_name,created,created_by,id_start,last_modified_by,last_modified_time,level_description_from_recommendations_v2,overview_from_recommendations_v2,recommendations_v2,schema_calculated_metric,schema_calculated_metric_ui_display,schema_calculated_metric_unit,schema_description,schema_elimination_comparison,schema_elimination_threshold,schema_evaluation_text,schema_failure_value,schema_frequency_requirement,schema_maximum_cap,schema_minimum_threshold,schema_progress_direction,schema_required_days,schema_success_value,schema_threshold,schema_tolerance_level,schema_total_days,schema_tracked_metrics,scoring_method,title_from_recommendations_v2,ui_display_from_schema_tracked_metrics,units_from_schema_tracked_metrics
rec623tTA6TxlSuSc,Gender: male_female | Age: Any | Risk Level: Any,REC0005.3-WEEKLY-ELIMINATION,Weekly Elimination - daily_alcoholic_drinks,2025-09-23T01:26:37.000Z,"{""id"": ""usrdgG7vRV8iqukqL"", ""email"": ""keegankdolan@gmail.com"", ""name"": ""Keegan Dolan""}",WEEKLY-ELIMINATION,"{""id"": ""usrdgG7vRV8iqukqL"", ""email"": ""keegankdolan@gmail.com"", ""name"": ""Keegan Dolan""}",2025-09-26T21:41:44.000Z,"Eliminate alcohol consumption entirely, with exception of rare social event if desired","Alcohol affects liver health, metabolic function, sleep quality, inflammation, and hormonal balance. For users with elevated GGT, ALT, hsCRP, or disrupted sleep, moderating or removing alcohol intake can lead to significant improvements in biomarker trends and subjective well-being over a 3–4 month protocol.",recEBmO5Apr89hClw,rec7xh74qIPjW6yPG,Drinks,rec5jWyoBqRHumiGH,"Binary threshold scoring for: Eliminate alcohol consumption entirely, with exception of rare social event if desired...",,,,0,daily,,,countdown,7,100,0,,7,rec4smaQXx1XCrH1O,recul4Rgag1jM3H4S,Reduce or Eliminate Alcohol Consumption,Drinks,rec5jWyoBqRHumiGH
recF34tZcCD7NlJjb,Gender: male_female | Age: Any | Risk Level: Any,REC0009.3-WEEKLY-ELIMINATION,Weekly Elimination - dietary_added_sugar_servings,2025-09-23T01:26:37.000Z,"{""id"": ""usrdgG7vRV8iqukqL"", ""email"": ""keegankdolan@gmail.com"", ""name"": ""Keegan Dolan""}",WEEKLY-ELIMINATION,"{""id"": ""usrdgG7vRV8iqukqL"", ""email"": ""keegankdolan@gmail.com"", ""name"": ""Keegan Dolan""}",2025-09-26T21:41:44.000Z,"Eliminate foods and drinks with added sugar entirely, except for rare/special occasions","Added sugar contributes to metabolic dysfunction, inflammation, and increased chronic disease risk. Reducing daily added sugar improves energy, supports healthy weight, and protects long-term cardiometabolic health. For this recommendation, a serving is any food or drink with about 8–12g of added sugar (e.g., 1 cookie, sweetened yogurt, granola bar, or can of soda). If the item is over 15g, count as 2 servings.",recidHVe68DNlK5oI,recNzOe2650EhKLI6,Servings,recZBMdCzE5sRxqOQ,Weekly elimination scoring for: Eliminate added sugar entirely...,,,,0,daily,,,countdown,7,100,0,,7,recaCw0rYWB00Tb0A,recul4Rgag1jM3H4S,Reduce Added Sugar Intake,Servings,recZBMdCzE5sRxqOQ
recFjRsUW8RjAGJED,Gender: male_female | Age: Any | Risk Level: Any,REC0010.3-WEEKLY-ELIMINATION,Weekly Elimination - dietary_processed_meat,2025-09-23T01:26:37.000Z,"{""id"": ""usrdgG7vRV8iqukqL"", ""email"": ""keegankdolan@gmail.com"", ""name"": ""Keegan Dolan""}",WEEKLY-ELIMINATION,"{""id"": ""usrdgG7vRV8iqukqL"", ""email"": ""keegankdolan@gmail.com"", ""name"": ""Keegan Dolan""}",2025-09-26T21:41:44.000Z,"Eliminate processed meat entirely, replacing with whole food protein sources","High intake of processed meats is linked to increased cancer, cardiovascular, and metabolic disease risk. Reducing processed meat supports longevity and promotes healthier eating.",recutBXbia6z32Nqu,recYLPMMzs0JXY9lU,Servings,recZBMdCzE5sRxqOQ,"Weekly elimination scoring for: Eliminate processed meat entirely, replacing with whole food protein sources...",,,,0,daily,,,countdown,7,100,0,,7,reco9DeFYVedQuQ3V,recul4Rgag1jM3H4S,Reduce Processed Meat Intake,Servings,recZBMdCzE5sRxqOQ
rec5fd4nCeqpYkCtn,Gender: male_female | Age: Any | Risk Level: Any,REC0022.3-WEEKLY-ELIMINATION,Weekly Elimination - eliminate ultra-processed foods entirely,2025-09-23T01:26:37.000Z,"{""id"": ""usrdgG7vRV8iqukqL"", ""email"": ""keegankdolan@gmail.com"", ""name"": ""Keegan Dolan""}",WEEKLY-ELIMINATION,"{""id"": ""usrdgG7vRV8iqukqL"", ""email"": ""keegankdolan@gmail.com"", ""name"": ""Keegan Dolan""}",2025-09-26T21:41:44.000Z,"Eliminate ultra-processed foods entirely, every day of the week","Ultra-processed foods (e.g., packaged snacks, sweetened beverages, fast food) increase risk for metabolic disease and inflammation. Reducing intake supports long-term health.",recDd6IqU5EonfaVX,recaOSieHgikeIksD,Servings,recZBMdCzE5sRxqOQ,SC-WEEKLY-ELIMINATION: Weekly elimination achievement for completely eliminating ultra-processed foods all week,==,0,eliminate entirely every day of the week,0,daily,100,0,countdown,7,100,0,zero,7,recNjyT4Wj1DIqywi,recul4Rgag1jM3H4S,Daily Ultra-Processed Foods,Servings,recZBMdCzE5sRxqOQ
recSZbCWiHj6tRe3c,Gender: male_female | Age: Any | Risk Level: Any,REC0023.3-WEEKLY-ELIMINATION,Weekly Elimination - eliminate takeout meals except special occasions,2025-09-23T01:26:37.000Z,"{""id"": ""usrdgG7vRV8iqukqL"", ""email"": ""keegankdolan@gmail.com"", ""name"": ""Keegan Dolan""}",WEEKLY-ELIMINATION,"{""id"": ""usrdgG7vRV8iqukqL"", ""email"": ""keegankdolan@gmail.com"", ""name"": ""Keegan Dolan""}",2025-09-26T21:41:44.000Z,Eliminate takeout outside of rare/special occasions   ,"Regular takeout or delivery meals, especially from fast food or chain restaurants, are often higher in calories, sodium, and unhealthy fats. Reducing takeout improves dietary quality and supports health.",rec2NKnDuis64uMrk,rec3WXBXeF91098Gc,Meals,rec9OxY60mezaCp2J,SC-WEEKLY-ELIMINATION: Weekly elimination achievement for eliminating takeout/delivery meals outside of rare/special occasions,==,0,eliminate except rare/special occasions every day of the week,0,daily,100,0,countdown,7,100,0,zero,7,recIXNrpx6Ku5QYSI,recul4Rgag1jM3H4S,Daily Takeout/Delivery Meals,Meals,rec9OxY60mezaCp2J
